"GC_ID","Internal_Standard_Volume_ID","date_extraction","MeOH_Volume_dissolved","date.derivatisation","TMSH_Volume","Sample_Volume_derivatized","comment.x","runinfo","experiment","area","name_pufa","runname","runinfo_original","comment.y","Time","Timestamp","Date","Time_of_day"
"Blind_09.01.2020","0","09/01/2020",50,NA,10,20,"","Blind 09.01.2020","blind",25214,"11:0","PUFA-KF_09.01.2020 10_18_261","Blind 09.01.2020","             ","09.01.2020 10_18_261","2020-01-09 10:18:26","2020-01-09"," 10:18:26"
"Blind_09.01.2020","0","09/01/2020",50,NA,10,20,"","Blind 09.01.2020","blind",26371,"12:0","PUFA-KF_09.01.2020 10_18_261","Blind 09.01.2020","             ","09.01.2020 10_18_261","2020-01-09 10:18:26","2020-01-09"," 10:18:26"
"Blind_09.01.2020","0","09/01/2020",50,NA,10,20,"","Blind 09.01.2020","blind",30923,"14:0","PUFA-KF_09.01.2020 10_18_261","Blind 09.01.2020","             ","09.01.2020 10_18_261","2020-01-09 10:18:26","2020-01-09"," 10:18:26"
"Blind_09.01.2020","0","09/01/2020",50,NA,10,20,"","Blind 09.01.2020","blind",10586,"14:1n-5","PUFA-KF_09.01.2020 10_18_261","Blind 09.01.2020","             ","09.01.2020 10_18_261","2020-01-09 10:18:26","2020-01-09"," 10:18:26"
"Blind_09.01.2020","0","09/01/2020",50,NA,10,20,"","Blind 09.01.2020","blind",34680,"15:0","PUFA-KF_09.01.2020 10_18_261","Blind 09.01.2020","             ","09.01.2020 10_18_261","2020-01-09 10:18:26","2020-01-09"," 10:18:26"
"Blind_09.01.2020","0","09/01/2020",50,NA,10,20,"","Blind 09.01.2020","blind",2474,"15:1n-5","PUFA-KF_09.01.2020 10_18_261","Blind 09.01.2020","             ","09.01.2020 10_18_261","2020-01-09 10:18:26","2020-01-09"," 10:18:26"
"Blind_09.01.2020","0","09/01/2020",50,NA,10,20,"","Blind 09.01.2020","blind",13682,"16:0","PUFA-KF_09.01.2020 10_18_261","Blind 09.01.2020","             ","09.01.2020 10_18_261","2020-01-09 10:18:26","2020-01-09"," 10:18:26"
"Blind_09.01.2020","0","09/01/2020",50,NA,10,20,"","Blind 09.01.2020","blind",7094,"16:1n-7","PUFA-KF_09.01.2020 10_18_261","Blind 09.01.2020","             ","09.01.2020 10_18_261","2020-01-09 10:18:26","2020-01-09"," 10:18:26"
"Blind_09.01.2020","0","09/01/2020",50,NA,10,20,"","Blind 09.01.2020","blind",351061,"17:0","PUFA-KF_09.01.2020 10_18_261","Blind 09.01.2020","             ","09.01.2020 10_18_261","2020-01-09 10:18:26","2020-01-09"," 10:18:26"
"Blind_09.01.2020","0","09/01/2020",50,NA,10,20,"","Blind 09.01.2020","blind",12994,"17:1n-7","PUFA-KF_09.01.2020 10_18_261","Blind 09.01.2020","             ","09.01.2020 10_18_261","2020-01-09 10:18:26","2020-01-09"," 10:18:26"
"Blind_09.01.2020","0","09/01/2020",50,NA,10,20,"","Blind 09.01.2020","blind",26232,"18:0","PUFA-KF_09.01.2020 10_18_261","Blind 09.01.2020","             ","09.01.2020 10_18_261","2020-01-09 10:18:26","2020-01-09"," 10:18:26"
"Blind_09.01.2020","0","09/01/2020",50,NA,10,20,"","Blind 09.01.2020","blind",11606,"18:1n-9t","PUFA-KF_09.01.2020 10_18_261","Blind 09.01.2020","             ","09.01.2020 10_18_261","2020-01-09 10:18:26","2020-01-09"," 10:18:26"
"Blind_09.01.2020","0","09/01/2020",50,NA,10,20,"","Blind 09.01.2020","blind",439801,"18:1n-9c","PUFA-KF_09.01.2020 10_18_261","Blind 09.01.2020","             ","09.01.2020 10_18_261","2020-01-09 10:18:26","2020-01-09"," 10:18:26"
"Blind_09.01.2020","0","09/01/2020",50,NA,10,20,"","Blind 09.01.2020","blind",186448,"18:1n-7","PUFA-KF_09.01.2020 10_18_261","Blind 09.01.2020","             ","09.01.2020 10_18_261","2020-01-09 10:18:26","2020-01-09"," 10:18:26"
"Blind_09.01.2020","0","09/01/2020",50,NA,10,20,"","Blind 09.01.2020","blind",550,"18:2n-6t","PUFA-KF_09.01.2020 10_18_261","Blind 09.01.2020","             ","09.01.2020 10_18_261","2020-01-09 10:18:26","2020-01-09"," 10:18:26"
"Blind_09.01.2020","0","09/01/2020",50,NA,10,20,"","Blind 09.01.2020","blind",114919,"18:2n-6c","PUFA-KF_09.01.2020 10_18_261","Blind 09.01.2020","             ","09.01.2020 10_18_261","2020-01-09 10:18:26","2020-01-09"," 10:18:26"
"Blind_09.01.2020","0","09/01/2020",50,NA,10,20,"","Blind 09.01.2020","blind",167426,"18:3n-3","PUFA-KF_09.01.2020 10_18_261","Blind 09.01.2020","             ","09.01.2020 10_18_261","2020-01-09 10:18:26","2020-01-09"," 10:18:26"
"Blind_09.01.2020","0","09/01/2020",50,NA,10,20,"","Blind 09.01.2020","blind",190513,"20:0","PUFA-KF_09.01.2020 10_18_261","Blind 09.01.2020","             ","09.01.2020 10_18_261","2020-01-09 10:18:26","2020-01-09"," 10:18:26"
"Blind_09.01.2020","0","09/01/2020",50,NA,10,20,"","Blind 09.01.2020","blind",29775,"20:1n-9","PUFA-KF_09.01.2020 10_18_261","Blind 09.01.2020","             ","09.01.2020 10_18_261","2020-01-09 10:18:26","2020-01-09"," 10:18:26"
"Blind_09.01.2020","0","09/01/2020",50,NA,10,20,"","Blind 09.01.2020","blind",26086,"20:2n-6","PUFA-KF_09.01.2020 10_18_261","Blind 09.01.2020","             ","09.01.2020 10_18_261","2020-01-09 10:18:26","2020-01-09"," 10:18:26"
"Blind_09.01.2020","0","09/01/2020",50,NA,10,20,"","Blind 09.01.2020","blind",2074,"20:3n-6","PUFA-KF_09.01.2020 10_18_261","Blind 09.01.2020","             ","09.01.2020 10_18_261","2020-01-09 10:18:26","2020-01-09"," 10:18:26"
"Blind_09.01.2020","0","09/01/2020",50,NA,10,20,"","Blind 09.01.2020","blind",128590,"21:0","PUFA-KF_09.01.2020 10_18_261","Blind 09.01.2020","             ","09.01.2020 10_18_261","2020-01-09 10:18:26","2020-01-09"," 10:18:26"
"Blind_09.01.2020","0","09/01/2020",50,NA,10,20,"","Blind 09.01.2020","blind",14180,"20:5n-3","PUFA-KF_09.01.2020 10_18_261","Blind 09.01.2020","             ","09.01.2020 10_18_261","2020-01-09 10:18:26","2020-01-09"," 10:18:26"
"Blind_09.01.2020","0","09/01/2020",50,NA,10,20,"","Blind 09.01.2020","blind",83182,"22:0","PUFA-KF_09.01.2020 10_18_261","Blind 09.01.2020","             ","09.01.2020 10_18_261","2020-01-09 10:18:26","2020-01-09"," 10:18:26"
"Blind_09.01.2020","0","09/01/2020",50,NA,10,20,"","Blind 09.01.2020","blind",11804,"22:1n-9","PUFA-KF_09.01.2020 10_18_261","Blind 09.01.2020","             ","09.01.2020 10_18_261","2020-01-09 10:18:26","2020-01-09"," 10:18:26"
"Blind_09.01.2020","0","09/01/2020",50,NA,10,20,"","Blind 09.01.2020","blind",24883,"23:0","PUFA-KF_09.01.2020 10_18_261","Blind 09.01.2020","             ","09.01.2020 10_18_261","2020-01-09 10:18:26","2020-01-09"," 10:18:26"
"Blind_09.01.2020","0","09/01/2020",50,NA,10,20,"","Blind 09.01.2020","blind",26325,"22:6n-3","PUFA-KF_09.01.2020 10_18_261","Blind 09.01.2020","             ","09.01.2020 10_18_261","2020-01-09 10:18:26","2020-01-09"," 10:18:26"
"Blind_09.01.2020","0","09/01/2020",50,NA,10,20,"","Blind 09.01.2020","blind",16955,"24:1n-9","PUFA-KF_09.01.2020 10_18_261","Blind 09.01.2020","             ","09.01.2020 10_18_261","2020-01-09 10:18:26","2020-01-09"," 10:18:26"
"Blind_1_22.01.2020","0","22/01/2020",100,NA,10,20,"","Blind 1 22.01.2020","blind",8195,"12:0","PUFA-KF_24.01.2020 01_59_4212","Blind 1 22.01.2020","             ","24.01.2020 01_59_4212","2020-01-24 01:59:42","2020-01-24"," 01:59:42"
"Blind_1_22.01.2020","0","22/01/2020",100,NA,10,20,"","Blind 1 22.01.2020","blind",4472,"15:0","PUFA-KF_24.01.2020 01_59_4212","Blind 1 22.01.2020","             ","24.01.2020 01_59_4212","2020-01-24 01:59:42","2020-01-24"," 01:59:42"
"Blind_1_22.01.2020","0","22/01/2020",100,NA,10,20,"","Blind 1 22.01.2020","blind",345842,"17:0","PUFA-KF_24.01.2020 01_59_4212","Blind 1 22.01.2020","             ","24.01.2020 01_59_4212","2020-01-24 01:59:42","2020-01-24"," 01:59:42"
"Blind_1_22.01.2020","0","22/01/2020",100,NA,10,20,"","Blind 1 22.01.2020","blind",248325,"17:1n-7","PUFA-KF_24.01.2020 01_59_4212","Blind 1 22.01.2020","             ","24.01.2020 01_59_4212","2020-01-24 01:59:42","2020-01-24"," 01:59:42"
"Blind_1_22.01.2020","0","22/01/2020",100,NA,10,20,"","Blind 1 22.01.2020","blind",21432,"18:0","PUFA-KF_24.01.2020 01_59_4212","Blind 1 22.01.2020","             ","24.01.2020 01_59_4212","2020-01-24 01:59:42","2020-01-24"," 01:59:42"
"Blind_1_22.01.2020","0","22/01/2020",100,NA,10,20,"","Blind 1 22.01.2020","blind",148168,"18:1n-9t","PUFA-KF_24.01.2020 01_59_4212","Blind 1 22.01.2020","             ","24.01.2020 01_59_4212","2020-01-24 01:59:42","2020-01-24"," 01:59:42"
"Blind_1_22.01.2020","0","22/01/2020",100,NA,10,20,"","Blind 1 22.01.2020","blind",316553,"18:1n-7","PUFA-KF_24.01.2020 01_59_4212","Blind 1 22.01.2020","             ","24.01.2020 01_59_4212","2020-01-24 01:59:42","2020-01-24"," 01:59:42"
"Blind_1_22.01.2020","0","22/01/2020",100,NA,10,20,"","Blind 1 22.01.2020","blind",209,"18:2n-6t","PUFA-KF_24.01.2020 01_59_4212","Blind 1 22.01.2020","             ","24.01.2020 01_59_4212","2020-01-24 01:59:42","2020-01-24"," 01:59:42"
"Blind_1_22.01.2020","0","22/01/2020",100,NA,10,20,"","Blind 1 22.01.2020","blind",31093,"18:2n-6c","PUFA-KF_24.01.2020 01_59_4212","Blind 1 22.01.2020","             ","24.01.2020 01_59_4212","2020-01-24 01:59:42","2020-01-24"," 01:59:42"
"Blind_1_22.01.2020","0","22/01/2020",100,NA,10,20,"","Blind 1 22.01.2020","blind",14724,"18:3n-6","PUFA-KF_24.01.2020 01_59_4212","Blind 1 22.01.2020","             ","24.01.2020 01_59_4212","2020-01-24 01:59:42","2020-01-24"," 01:59:42"
"Blind_1_22.01.2020","0","22/01/2020",100,NA,10,20,"","Blind 1 22.01.2020","blind",20682,"18:3n-3","PUFA-KF_24.01.2020 01_59_4212","Blind 1 22.01.2020","             ","24.01.2020 01_59_4212","2020-01-24 01:59:42","2020-01-24"," 01:59:42"
"Blind_1_22.01.2020","0","22/01/2020",100,NA,10,20,"","Blind 1 22.01.2020","blind",28473,"20:0","PUFA-KF_24.01.2020 01_59_4212","Blind 1 22.01.2020","             ","24.01.2020 01_59_4212","2020-01-24 01:59:42","2020-01-24"," 01:59:42"
"Blind_1_22.01.2020","0","22/01/2020",100,NA,10,20,"","Blind 1 22.01.2020","blind",10393,"20:1n-9","PUFA-KF_24.01.2020 01_59_4212","Blind 1 22.01.2020","             ","24.01.2020 01_59_4212","2020-01-24 01:59:42","2020-01-24"," 01:59:42"
"Blind_1_22.01.2020","0","22/01/2020",100,NA,10,20,"","Blind 1 22.01.2020","blind",5635,"20:2n-6","PUFA-KF_24.01.2020 01_59_4212","Blind 1 22.01.2020","             ","24.01.2020 01_59_4212","2020-01-24 01:59:42","2020-01-24"," 01:59:42"
"Blind_1_22.01.2020","0","22/01/2020",100,NA,10,20,"","Blind 1 22.01.2020","blind",49994,"20:3n-6","PUFA-KF_24.01.2020 01_59_4212","Blind 1 22.01.2020","             ","24.01.2020 01_59_4212","2020-01-24 01:59:42","2020-01-24"," 01:59:42"
"Blind_1_22.01.2020","0","22/01/2020",100,NA,10,20,"","Blind 1 22.01.2020","blind",49169,"20:4n-6","PUFA-KF_24.01.2020 01_59_4212","Blind 1 22.01.2020","             ","24.01.2020 01_59_4212","2020-01-24 01:59:42","2020-01-24"," 01:59:42"
"Blind_1_22.01.2020","0","22/01/2020",100,NA,10,20,"","Blind 1 22.01.2020","blind",2742,"21:0","PUFA-KF_24.01.2020 01_59_4212","Blind 1 22.01.2020","             ","24.01.2020 01_59_4212","2020-01-24 01:59:42","2020-01-24"," 01:59:42"
"Blind_1_22.01.2020","0","22/01/2020",100,NA,10,20,"","Blind 1 22.01.2020","blind",207961,"20:3n-3","PUFA-KF_24.01.2020 01_59_4212","Blind 1 22.01.2020","             ","24.01.2020 01_59_4212","2020-01-24 01:59:42","2020-01-24"," 01:59:42"
"Blind_1_22.01.2020","0","22/01/2020",100,NA,10,20,"","Blind 1 22.01.2020","blind",434,"20:5n-3","PUFA-KF_24.01.2020 01_59_4212","Blind 1 22.01.2020","             ","24.01.2020 01_59_4212","2020-01-24 01:59:42","2020-01-24"," 01:59:42"
"Blind_1_22.01.2020","0","22/01/2020",100,NA,10,20,"","Blind 1 22.01.2020","blind",1133,"22:0","PUFA-KF_24.01.2020 01_59_4212","Blind 1 22.01.2020","             ","24.01.2020 01_59_4212","2020-01-24 01:59:42","2020-01-24"," 01:59:42"
"Blind_1_22.01.2020","0","22/01/2020",100,NA,10,20,"","Blind 1 22.01.2020","blind",577,"22:1n-9","PUFA-KF_24.01.2020 01_59_4212","Blind 1 22.01.2020","             ","24.01.2020 01_59_4212","2020-01-24 01:59:42","2020-01-24"," 01:59:42"
"Blind_1_22.01.2020","0","22/01/2020",100,NA,10,20,"","Blind 1 22.01.2020","blind",504,"22:2n-6","PUFA-KF_24.01.2020 01_59_4212","Blind 1 22.01.2020","             ","24.01.2020 01_59_4212","2020-01-24 01:59:42","2020-01-24"," 01:59:42"
"Blind_1_22.01.2020","0","22/01/2020",100,NA,10,20,"","Blind 1 22.01.2020","blind",14077,"24:0","PUFA-KF_24.01.2020 01_59_4212","Blind 1 22.01.2020","             ","24.01.2020 01_59_4212","2020-01-24 01:59:42","2020-01-24"," 01:59:42"
"Blind_2_09.01.2020","0","09/01/2020",50,NA,10,20,"","Blind 2 09.01.2020","blind",3183,"12:0","PUFA-KF_14.01.2020 12_05_211","Blind 2. Durchgang 09.01.2019","09.01.2019             ","14.01.2020 12_05_211","2020-01-14 12:05:21","2020-01-14"," 12:05:21"
"Blind_2_09.01.2020","0","09/01/2020",50,NA,10,20,"","Blind 2 09.01.2020","blind",246710,"13:0","PUFA-KF_14.01.2020 12_05_211","Blind 2. Durchgang 09.01.2019","09.01.2019             ","14.01.2020 12_05_211","2020-01-14 12:05:21","2020-01-14"," 12:05:21"
"Blind_2_09.01.2020","0","09/01/2020",50,NA,10,20,"","Blind 2 09.01.2020","blind",93932,"15:0","PUFA-KF_14.01.2020 12_05_211","Blind 2. Durchgang 09.01.2019","09.01.2019             ","14.01.2020 12_05_211","2020-01-14 12:05:21","2020-01-14"," 12:05:21"
"Blind_2_09.01.2020","0","09/01/2020",50,NA,10,20,"","Blind 2 09.01.2020","blind",76947,"16:0","PUFA-KF_14.01.2020 12_05_211","Blind 2. Durchgang 09.01.2019","09.01.2019             ","14.01.2020 12_05_211","2020-01-14 12:05:21","2020-01-14"," 12:05:21"
"Blind_2_09.01.2020","0","09/01/2020",50,NA,10,20,"","Blind 2 09.01.2020","blind",36542,"16:1n-7","PUFA-KF_14.01.2020 12_05_211","Blind 2. Durchgang 09.01.2019","09.01.2019             ","14.01.2020 12_05_211","2020-01-14 12:05:21","2020-01-14"," 12:05:21"
"Blind_2_09.01.2020","0","09/01/2020",50,NA,10,20,"","Blind 2 09.01.2020","blind",1466818,"17:0","PUFA-KF_14.01.2020 12_05_211","Blind 2. Durchgang 09.01.2019","09.01.2019             ","14.01.2020 12_05_211","2020-01-14 12:05:21","2020-01-14"," 12:05:21"
"Blind_2_09.01.2020","0","09/01/2020",50,NA,10,20,"","Blind 2 09.01.2020","blind",120690,"17:1n-7","PUFA-KF_14.01.2020 12_05_211","Blind 2. Durchgang 09.01.2019","09.01.2019             ","14.01.2020 12_05_211","2020-01-14 12:05:21","2020-01-14"," 12:05:21"
"Blind_2_09.01.2020","0","09/01/2020",50,NA,10,20,"","Blind 2 09.01.2020","blind",237472,"18:0","PUFA-KF_14.01.2020 12_05_211","Blind 2. Durchgang 09.01.2019","09.01.2019             ","14.01.2020 12_05_211","2020-01-14 12:05:21","2020-01-14"," 12:05:21"
"Blind_2_09.01.2020","0","09/01/2020",50,NA,10,20,"","Blind 2 09.01.2020","blind",40529,"18:1n-9t","PUFA-KF_14.01.2020 12_05_211","Blind 2. Durchgang 09.01.2019","09.01.2019             ","14.01.2020 12_05_211","2020-01-14 12:05:21","2020-01-14"," 12:05:21"
"Blind_2_09.01.2020","0","09/01/2020",50,NA,10,20,"","Blind 2 09.01.2020","blind",476150,"18:1n-9c","PUFA-KF_14.01.2020 12_05_211","Blind 2. Durchgang 09.01.2019","09.01.2019             ","14.01.2020 12_05_211","2020-01-14 12:05:21","2020-01-14"," 12:05:21"
"Blind_2_09.01.2020","0","09/01/2020",50,NA,10,20,"","Blind 2 09.01.2020","blind",335536,"18:1n-7","PUFA-KF_14.01.2020 12_05_211","Blind 2. Durchgang 09.01.2019","09.01.2019             ","14.01.2020 12_05_211","2020-01-14 12:05:21","2020-01-14"," 12:05:21"
"Blind_2_09.01.2020","0","09/01/2020",50,NA,10,20,"","Blind 2 09.01.2020","blind",57076,"18:2n-6t","PUFA-KF_14.01.2020 12_05_211","Blind 2. Durchgang 09.01.2019","09.01.2019             ","14.01.2020 12_05_211","2020-01-14 12:05:21","2020-01-14"," 12:05:21"
"Blind_2_09.01.2020","0","09/01/2020",50,NA,10,20,"","Blind 2 09.01.2020","blind",526763,"18:2n-6c","PUFA-KF_14.01.2020 12_05_211","Blind 2. Durchgang 09.01.2019","09.01.2019             ","14.01.2020 12_05_211","2020-01-14 12:05:21","2020-01-14"," 12:05:21"
"Blind_2_09.01.2020","0","09/01/2020",50,NA,10,20,"","Blind 2 09.01.2020","blind",85108,"18:3n-6","PUFA-KF_14.01.2020 12_05_211","Blind 2. Durchgang 09.01.2019","09.01.2019             ","14.01.2020 12_05_211","2020-01-14 12:05:21","2020-01-14"," 12:05:21"
"Blind_2_09.01.2020","0","09/01/2020",50,NA,10,20,"","Blind 2 09.01.2020","blind",179965,"18:3n-3","PUFA-KF_14.01.2020 12_05_211","Blind 2. Durchgang 09.01.2019","09.01.2019             ","14.01.2020 12_05_211","2020-01-14 12:05:21","2020-01-14"," 12:05:21"
"Blind_2_09.01.2020","0","09/01/2020",50,NA,10,20,"","Blind 2 09.01.2020","blind",304252,"20:0","PUFA-KF_14.01.2020 12_05_211","Blind 2. Durchgang 09.01.2019","09.01.2019             ","14.01.2020 12_05_211","2020-01-14 12:05:21","2020-01-14"," 12:05:21"
"Blind_2_09.01.2020","0","09/01/2020",50,NA,10,20,"","Blind 2 09.01.2020","blind",78431,"20:1n-9","PUFA-KF_14.01.2020 12_05_211","Blind 2. Durchgang 09.01.2019","09.01.2019             ","14.01.2020 12_05_211","2020-01-14 12:05:21","2020-01-14"," 12:05:21"
"Blind_2_09.01.2020","0","09/01/2020",50,NA,10,20,"","Blind 2 09.01.2020","blind",79690,"20:2n-6","PUFA-KF_14.01.2020 12_05_211","Blind 2. Durchgang 09.01.2019","09.01.2019             ","14.01.2020 12_05_211","2020-01-14 12:05:21","2020-01-14"," 12:05:21"
"Blind_2_09.01.2020","0","09/01/2020",50,NA,10,20,"","Blind 2 09.01.2020","blind",49211,"20:3n-6","PUFA-KF_14.01.2020 12_05_211","Blind 2. Durchgang 09.01.2019","09.01.2019             ","14.01.2020 12_05_211","2020-01-14 12:05:21","2020-01-14"," 12:05:21"
"Blind_2_09.01.2020","0","09/01/2020",50,NA,10,20,"","Blind 2 09.01.2020","blind",33041,"20:4n-6","PUFA-KF_14.01.2020 12_05_211","Blind 2. Durchgang 09.01.2019","09.01.2019             ","14.01.2020 12_05_211","2020-01-14 12:05:21","2020-01-14"," 12:05:21"
"Blind_2_09.01.2020","0","09/01/2020",50,NA,10,20,"","Blind 2 09.01.2020","blind",189700,"21:0","PUFA-KF_14.01.2020 12_05_211","Blind 2. Durchgang 09.01.2019","09.01.2019             ","14.01.2020 12_05_211","2020-01-14 12:05:21","2020-01-14"," 12:05:21"
"Blind_2_09.01.2020","0","09/01/2020",50,NA,10,20,"","Blind 2 09.01.2020","blind",22067,"20:5n-3","PUFA-KF_14.01.2020 12_05_211","Blind 2. Durchgang 09.01.2019","09.01.2019             ","14.01.2020 12_05_211","2020-01-14 12:05:21","2020-01-14"," 12:05:21"
"Blind_2_09.01.2020","0","09/01/2020",50,NA,10,20,"","Blind 2 09.01.2020","blind",245711,"22:0","PUFA-KF_14.01.2020 12_05_211","Blind 2. Durchgang 09.01.2019","09.01.2019             ","14.01.2020 12_05_211","2020-01-14 12:05:21","2020-01-14"," 12:05:21"
"Blind_2_09.01.2020","0","09/01/2020",50,NA,10,20,"","Blind 2 09.01.2020","blind",135341,"22:1n-9","PUFA-KF_14.01.2020 12_05_211","Blind 2. Durchgang 09.01.2019","09.01.2019             ","14.01.2020 12_05_211","2020-01-14 12:05:21","2020-01-14"," 12:05:21"
"Blind_2_09.01.2020","0","09/01/2020",50,NA,10,20,"","Blind 2 09.01.2020","blind",82321,"22:2n-6","PUFA-KF_14.01.2020 12_05_211","Blind 2. Durchgang 09.01.2019","09.01.2019             ","14.01.2020 12_05_211","2020-01-14 12:05:21","2020-01-14"," 12:05:21"
"Blind_2_09.01.2020","0","09/01/2020",50,NA,10,20,"","Blind 2 09.01.2020","blind",227080,"23:0","PUFA-KF_14.01.2020 12_05_211","Blind 2. Durchgang 09.01.2019","09.01.2019             ","14.01.2020 12_05_211","2020-01-14 12:05:21","2020-01-14"," 12:05:21"
"Blind_2_09.01.2020","0","09/01/2020",50,NA,10,20,"","Blind 2 09.01.2020","blind",29410,"22:6n-3","PUFA-KF_14.01.2020 12_05_211","Blind 2. Durchgang 09.01.2019","09.01.2019             ","14.01.2020 12_05_211","2020-01-14 12:05:21","2020-01-14"," 12:05:21"
"Blind_2_09.01.2020","0","09/01/2020",50,NA,10,20,"","Blind 2 09.01.2020","blind",285450,"24:0","PUFA-KF_14.01.2020 12_05_211","Blind 2. Durchgang 09.01.2019","09.01.2019             ","14.01.2020 12_05_211","2020-01-14 12:05:21","2020-01-14"," 12:05:21"
"Blind_1_25.05.2020_26.05.2020_12_22_162","0","25/05/2020",50,NA,10,20,"","Blind 1 25.05.2020 26.05.2020 12 22 162","blind",156062,"14:0","PUFA-KF_26.05.2020 12_22_162","Blind 25.05.2020 1","             ","26.05.2020 12_22_162","2020-05-26 12:22:16","2020-05-26"," 12:22:16"
"Blind_1_25.05.2020_26.05.2020_12_22_162","0","25/05/2020",50,NA,10,20,"","Blind 1 25.05.2020 26.05.2020 12 22 162","blind",13140,"15:1n-5","PUFA-KF_26.05.2020 12_22_162","Blind 25.05.2020 1","             ","26.05.2020 12_22_162","2020-05-26 12:22:16","2020-05-26"," 12:22:16"
"Blind_1_25.05.2020_26.05.2020_12_22_162","0","25/05/2020",50,NA,10,20,"","Blind 1 25.05.2020 26.05.2020 12 22 162","blind",94647,"17:1n-7","PUFA-KF_26.05.2020 12_22_162","Blind 25.05.2020 1","             ","26.05.2020 12_22_162","2020-05-26 12:22:16","2020-05-26"," 12:22:16"
"Blind_1_25.05.2020_26.05.2020_12_22_162","0","25/05/2020",50,NA,10,20,"","Blind 1 25.05.2020 26.05.2020 12 22 162","blind",6005,"20:0","PUFA-KF_26.05.2020 12_22_162","Blind 25.05.2020 1","             ","26.05.2020 12_22_162","2020-05-26 12:22:16","2020-05-26"," 12:22:16"
"Blind_1_25.05.2020_28.05.2020_15_52_382","0","25/05/2020",50,NA,10,20,"","Blind 1 25.05.2020 28.05.2020 15 52 382","blind",NA,NA,NA,NA,NA,NA,NA,NA,NA
"Blind_2_25.05.2020","0","25/05/2020",50,NA,10,20,"in sequenz verschrieben","Blind 2 25.05.2020","blind",57475,"12:0","PUFA-KF_27.05.2020 19_01_3635","Blind 2 25.06.2020","             ","27.05.2020 19_01_3635","2020-05-27 19:01:36","2020-05-27"," 19:01:36"
"Blind_2_25.05.2020","0","25/05/2020",50,NA,10,20,"in sequenz verschrieben","Blind 2 25.05.2020","blind",192833,"14:0","PUFA-KF_27.05.2020 19_01_3635","Blind 2 25.06.2020","             ","27.05.2020 19_01_3635","2020-05-27 19:01:36","2020-05-27"," 19:01:36"
"Blind_2_25.05.2020","0","25/05/2020",50,NA,10,20,"in sequenz verschrieben","Blind 2 25.05.2020","blind",60084,"18:1n-7","PUFA-KF_27.05.2020 19_01_3635","Blind 2 25.06.2020","             ","27.05.2020 19_01_3635","2020-05-27 19:01:36","2020-05-27"," 19:01:36"
"Blind_2_25.05.2020","0","25/05/2020",50,NA,10,20,"in sequenz verschrieben","Blind 2 25.05.2020","blind",19761,"18:2n-6c","PUFA-KF_27.05.2020 19_01_3635","Blind 2 25.06.2020","             ","27.05.2020 19_01_3635","2020-05-27 19:01:36","2020-05-27"," 19:01:36"
"Blind_1_26.05.2020","0","26/05/2020",100,NA,10,20,"in sequenz verschrieben","Blind 1 26.05.2020","blind",18043,"12:0","PUFA-KF_29.05.2020 04_01_4014","Blind 1 26.06.2019","             ","29.05.2020 04_01_4014","2020-05-29 04:01:40","2020-05-29"," 04:01:40"
"Blind_1_26.05.2020","0","26/05/2020",100,NA,10,20,"in sequenz verschrieben","Blind 1 26.05.2020","blind",179628,"14:0","PUFA-KF_29.05.2020 04_01_4014","Blind 1 26.06.2019","             ","29.05.2020 04_01_4014","2020-05-29 04:01:40","2020-05-29"," 04:01:40"
"Blind_1_26.05.2020","0","26/05/2020",100,NA,10,20,"in sequenz verschrieben","Blind 1 26.05.2020","blind",88223,"15:1n-5","PUFA-KF_29.05.2020 04_01_4014","Blind 1 26.06.2019","             ","29.05.2020 04_01_4014","2020-05-29 04:01:40","2020-05-29"," 04:01:40"
"Blind_1_26.05.2020","0","26/05/2020",100,NA,10,20,"in sequenz verschrieben","Blind 1 26.05.2020","blind",1241545,"17:1n-7","PUFA-KF_29.05.2020 04_01_4014","Blind 1 26.06.2019","             ","29.05.2020 04_01_4014","2020-05-29 04:01:40","2020-05-29"," 04:01:40"
"Blind_1_26.05.2020","0","26/05/2020",100,NA,10,20,"in sequenz verschrieben","Blind 1 26.05.2020","blind",117365,"18:0","PUFA-KF_29.05.2020 04_01_4014","Blind 1 26.06.2019","             ","29.05.2020 04_01_4014","2020-05-29 04:01:40","2020-05-29"," 04:01:40"
"Blind_1_26.05.2020","0","26/05/2020",100,NA,10,20,"in sequenz verschrieben","Blind 1 26.05.2020","blind",148072,"18:1n-9t","PUFA-KF_29.05.2020 04_01_4014","Blind 1 26.06.2019","             ","29.05.2020 04_01_4014","2020-05-29 04:01:40","2020-05-29"," 04:01:40"
"Blind_1_26.05.2020","0","26/05/2020",100,NA,10,20,"in sequenz verschrieben","Blind 1 26.05.2020","blind",214097,"18:1n-7","PUFA-KF_29.05.2020 04_01_4014","Blind 1 26.06.2019","             ","29.05.2020 04_01_4014","2020-05-29 04:01:40","2020-05-29"," 04:01:40"
"Blind_1_26.05.2020","0","26/05/2020",100,NA,10,20,"in sequenz verschrieben","Blind 1 26.05.2020","blind",1258042,"18:2n-6t","PUFA-KF_29.05.2020 04_01_4014","Blind 1 26.06.2019","             ","29.05.2020 04_01_4014","2020-05-29 04:01:40","2020-05-29"," 04:01:40"
"Blind_1_26.05.2020","0","26/05/2020",100,NA,10,20,"in sequenz verschrieben","Blind 1 26.05.2020","blind",1356937,"18:3n-6","PUFA-KF_29.05.2020 04_01_4014","Blind 1 26.06.2019","             ","29.05.2020 04_01_4014","2020-05-29 04:01:40","2020-05-29"," 04:01:40"
"Blind_2_26.05.2020","0","26/05/2020",100,NA,10,20,"","Blind 2 26.05.2020","blind",81074,"14:0","PUFA-KF_31.05.2020 07_34_2149","Blind 2 26.05.2019","             ","31.05.2020 07_34_2149","2020-05-31 07:34:21","2020-05-31"," 07:34:21"
"Blind_2_26.05.2020","0","26/05/2020",100,NA,10,20,"","Blind 2 26.05.2020","blind",57728,"15:1n-5","PUFA-KF_31.05.2020 07_34_2149","Blind 2 26.05.2019","             ","31.05.2020 07_34_2149","2020-05-31 07:34:21","2020-05-31"," 07:34:21"
"Blind_2_26.05.2020","0","26/05/2020",100,NA,10,20,"","Blind 2 26.05.2020","blind",2231430,"17:1n-7","PUFA-KF_31.05.2020 07_34_2149","Blind 2 26.05.2019","             ","31.05.2020 07_34_2149","2020-05-31 07:34:21","2020-05-31"," 07:34:21"
"Blind_2_26.05.2020","0","26/05/2020",100,NA,10,20,"","Blind 2 26.05.2020","blind",168179,"18:0","PUFA-KF_31.05.2020 07_34_2149","Blind 2 26.05.2019","             ","31.05.2020 07_34_2149","2020-05-31 07:34:21","2020-05-31"," 07:34:21"
"Blind_2_26.05.2020","0","26/05/2020",100,NA,10,20,"","Blind 2 26.05.2020","blind",1459887,"18:1n-9t","PUFA-KF_31.05.2020 07_34_2149","Blind 2 26.05.2019","             ","31.05.2020 07_34_2149","2020-05-31 07:34:21","2020-05-31"," 07:34:21"
"Blind_2_26.05.2020","0","26/05/2020",100,NA,10,20,"","Blind 2 26.05.2020","blind",197913,"18:1n-7","PUFA-KF_31.05.2020 07_34_2149","Blind 2 26.05.2019","             ","31.05.2020 07_34_2149","2020-05-31 07:34:21","2020-05-31"," 07:34:21"
"Blind_2_26.05.2020","0","26/05/2020",100,NA,10,20,"","Blind 2 26.05.2020","blind",515050,"18:2n-6t","PUFA-KF_31.05.2020 07_34_2149","Blind 2 26.05.2019","             ","31.05.2020 07_34_2149","2020-05-31 07:34:21","2020-05-31"," 07:34:21"
"Blind_2_26.05.2020","0","26/05/2020",100,NA,10,20,"","Blind 2 26.05.2020","blind",1748679,"18:3n-6","PUFA-KF_31.05.2020 07_34_2149","Blind 2 26.05.2019","             ","31.05.2020 07_34_2149","2020-05-31 07:34:21","2020-05-31"," 07:34:21"
"Blind_2_26.05.2020","0","26/05/2020",100,NA,10,20,"","Blind 2 26.05.2020","blind",81818,"18:3n-3","PUFA-KF_31.05.2020 07_34_2149","Blind 2 26.05.2019","             ","31.05.2020 07_34_2149","2020-05-31 07:34:21","2020-05-31"," 07:34:21"
"Blind_2_26.05.2020","0","26/05/2020",100,NA,10,20,"","Blind 2 26.05.2020","blind",358705,"23:0","PUFA-KF_31.05.2020 07_34_2149","Blind 2 26.05.2019","             ","31.05.2020 07_34_2149","2020-05-31 07:34:21","2020-05-31"," 07:34:21"
"Blind_1_27.05.2020","0","27/05/2020",50,NA,10,20,"in sequenz verschrieben","Blind 1 27.05.2020","blind",30583,"12:0","PUFA-KF_01.06.2020 14_13_3482","Blind 1 27.05.2019","             ","01.06.2020 14_13_3482","2020-06-01 14:13:34","2020-06-01"," 14:13:34"
"Blind_1_27.05.2020","0","27/05/2020",50,NA,10,20,"in sequenz verschrieben","Blind 1 27.05.2020","blind",1596351,"17:1n-7","PUFA-KF_01.06.2020 14_13_3482","Blind 1 27.05.2019","             ","01.06.2020 14_13_3482","2020-06-01 14:13:34","2020-06-01"," 14:13:34"
"Blind_1_27.05.2020","0","27/05/2020",50,NA,10,20,"in sequenz verschrieben","Blind 1 27.05.2020","blind",510261,"18:1n-7","PUFA-KF_01.06.2020 14_13_3482","Blind 1 27.05.2019","             ","01.06.2020 14_13_3482","2020-06-01 14:13:34","2020-06-01"," 14:13:34"
"Blind_1_27.05.2020","0","27/05/2020",50,NA,10,20,"in sequenz verschrieben","Blind 1 27.05.2020","blind",1020003,"18:2n-6c","PUFA-KF_01.06.2020 14_13_3482","Blind 1 27.05.2019","             ","01.06.2020 14_13_3482","2020-06-01 14:13:34","2020-06-01"," 14:13:34"
"Blind_2_27.05.2020","0","27/05/2020",50,NA,10,20,"","Blind 2 27.05.2020","blind",49501,"12:0","PUFA-KF_31.05.2020 17_47_2760","Blind 2 27.05.2020","             ","31.05.2020 17_47_2760","2020-05-31 17:47:27","2020-05-31"," 17:47:27"
"Blind_2_27.05.2020","0","27/05/2020",50,NA,10,20,"","Blind 2 27.05.2020","blind",283585,"14:0","PUFA-KF_31.05.2020 17_47_2760","Blind 2 27.05.2020","             ","31.05.2020 17_47_2760","2020-05-31 17:47:27","2020-05-31"," 17:47:27"
"Blind_2_27.05.2020","0","27/05/2020",50,NA,10,20,"","Blind 2 27.05.2020","blind",1517187,"17:1n-7","PUFA-KF_31.05.2020 17_47_2760","Blind 2 27.05.2020","             ","31.05.2020 17_47_2760","2020-05-31 17:47:27","2020-05-31"," 17:47:27"
"Blind_2_27.05.2020","0","27/05/2020",50,NA,10,20,"","Blind 2 27.05.2020","blind",1133093,"18:1n-9t","PUFA-KF_31.05.2020 17_47_2760","Blind 2 27.05.2020","             ","31.05.2020 17_47_2760","2020-05-31 17:47:27","2020-05-31"," 17:47:27"
"Blind_2_27.05.2020","0","27/05/2020",50,NA,10,20,"","Blind 2 27.05.2020","blind",722432,"18:2n-6t","PUFA-KF_31.05.2020 17_47_2760","Blind 2 27.05.2020","             ","31.05.2020 17_47_2760","2020-05-31 17:47:27","2020-05-31"," 17:47:27"
"Blind_2_27.05.2020","0","27/05/2020",50,NA,10,20,"","Blind 2 27.05.2020","blind",1219667,"18:2n-6c","PUFA-KF_31.05.2020 17_47_2760","Blind 2 27.05.2020","             ","31.05.2020 17_47_2760","2020-05-31 17:47:27","2020-05-31"," 17:47:27"
"Blind_2_02.02.2020","0","02/02/2020",100,NA,10,20,"","Blind 2 02.02.2020","blind",45047,"12:0","PUFA-KF_05.02.2020 20_58_3424","Blind 2 02.02.2020","             ","05.02.2020 20_58_3424","2020-02-05 20:58:34","2020-02-05"," 20:58:34"
"Blind_2_02.02.2020","0","02/02/2020",100,NA,10,20,"","Blind 2 02.02.2020","blind",4343,"13:0","PUFA-KF_05.02.2020 20_58_3424","Blind 2 02.02.2020","             ","05.02.2020 20_58_3424","2020-02-05 20:58:34","2020-02-05"," 20:58:34"
"Blind_2_02.02.2020","0","02/02/2020",100,NA,10,20,"","Blind 2 02.02.2020","blind",148109,"14:0","PUFA-KF_05.02.2020 20_58_3424","Blind 2 02.02.2020","             ","05.02.2020 20_58_3424","2020-02-05 20:58:34","2020-02-05"," 20:58:34"
"Blind_2_02.02.2020","0","02/02/2020",100,NA,10,20,"","Blind 2 02.02.2020","blind",13670,"14:1n-5","PUFA-KF_05.02.2020 20_58_3424","Blind 2 02.02.2020","             ","05.02.2020 20_58_3424","2020-02-05 20:58:34","2020-02-05"," 20:58:34"
"Blind_2_02.02.2020","0","02/02/2020",100,NA,10,20,"","Blind 2 02.02.2020","blind",3078,"15:0","PUFA-KF_05.02.2020 20_58_3424","Blind 2 02.02.2020","             ","05.02.2020 20_58_3424","2020-02-05 20:58:34","2020-02-05"," 20:58:34"
"Blind_2_02.02.2020","0","02/02/2020",100,NA,10,20,"","Blind 2 02.02.2020","blind",68164,"15:1n-5","PUFA-KF_05.02.2020 20_58_3424","Blind 2 02.02.2020","             ","05.02.2020 20_58_3424","2020-02-05 20:58:34","2020-02-05"," 20:58:34"
"Blind_2_02.02.2020","0","02/02/2020",100,NA,10,20,"","Blind 2 02.02.2020","blind",5269,"16:1n-7","PUFA-KF_05.02.2020 20_58_3424","Blind 2 02.02.2020","             ","05.02.2020 20_58_3424","2020-02-05 20:58:34","2020-02-05"," 20:58:34"
"Blind_2_02.02.2020","0","02/02/2020",100,NA,10,20,"","Blind 2 02.02.2020","blind",2146,"17:0","PUFA-KF_05.02.2020 20_58_3424","Blind 2 02.02.2020","             ","05.02.2020 20_58_3424","2020-02-05 20:58:34","2020-02-05"," 20:58:34"
"Blind_2_02.02.2020","0","02/02/2020",100,NA,10,20,"","Blind 2 02.02.2020","blind",241383,"17:1n-7","PUFA-KF_05.02.2020 20_58_3424","Blind 2 02.02.2020","             ","05.02.2020 20_58_3424","2020-02-05 20:58:34","2020-02-05"," 20:58:34"
"Blind_2_02.02.2020","0","02/02/2020",100,NA,10,20,"","Blind 2 02.02.2020","blind",2650,"18:0","PUFA-KF_05.02.2020 20_58_3424","Blind 2 02.02.2020","             ","05.02.2020 20_58_3424","2020-02-05 20:58:34","2020-02-05"," 20:58:34"
"Blind_2_02.02.2020","0","02/02/2020",100,NA,10,20,"","Blind 2 02.02.2020","blind",36242,"18:1n-9t","PUFA-KF_05.02.2020 20_58_3424","Blind 2 02.02.2020","             ","05.02.2020 20_58_3424","2020-02-05 20:58:34","2020-02-05"," 20:58:34"
"Blind_2_02.02.2020","0","02/02/2020",100,NA,10,20,"","Blind 2 02.02.2020","blind",1778,"18:1n-9c","PUFA-KF_05.02.2020 20_58_3424","Blind 2 02.02.2020","             ","05.02.2020 20_58_3424","2020-02-05 20:58:34","2020-02-05"," 20:58:34"
"Blind_2_02.02.2020","0","02/02/2020",100,NA,10,20,"","Blind 2 02.02.2020","blind",280360,"18:1n-7","PUFA-KF_05.02.2020 20_58_3424","Blind 2 02.02.2020","             ","05.02.2020 20_58_3424","2020-02-05 20:58:34","2020-02-05"," 20:58:34"
"Blind_2_02.02.2020","0","02/02/2020",100,NA,10,20,"","Blind 2 02.02.2020","blind",96646,"18:2n-6t","PUFA-KF_05.02.2020 20_58_3424","Blind 2 02.02.2020","             ","05.02.2020 20_58_3424","2020-02-05 20:58:34","2020-02-05"," 20:58:34"
"Blind_2_02.02.2020","0","02/02/2020",100,NA,10,20,"","Blind 2 02.02.2020","blind",164095,"18:2n-6c","PUFA-KF_05.02.2020 20_58_3424","Blind 2 02.02.2020","             ","05.02.2020 20_58_3424","2020-02-05 20:58:34","2020-02-05"," 20:58:34"
"Blind_2_02.02.2020","0","02/02/2020",100,NA,10,20,"","Blind 2 02.02.2020","blind",19785,"18:3n-3","PUFA-KF_05.02.2020 20_58_3424","Blind 2 02.02.2020","             ","05.02.2020 20_58_3424","2020-02-05 20:58:34","2020-02-05"," 20:58:34"
"Blind_2_02.02.2020","0","02/02/2020",100,NA,10,20,"","Blind 2 02.02.2020","blind",29090,"20:0","PUFA-KF_05.02.2020 20_58_3424","Blind 2 02.02.2020","             ","05.02.2020 20_58_3424","2020-02-05 20:58:34","2020-02-05"," 20:58:34"
"Blind_2_02.02.2020","0","02/02/2020",100,NA,10,20,"","Blind 2 02.02.2020","blind",33118,"20:1n-9","PUFA-KF_05.02.2020 20_58_3424","Blind 2 02.02.2020","             ","05.02.2020 20_58_3424","2020-02-05 20:58:34","2020-02-05"," 20:58:34"
"Blind_2_02.02.2020","0","02/02/2020",100,NA,10,20,"","Blind 2 02.02.2020","blind",202,"20:2n-6","PUFA-KF_05.02.2020 20_58_3424","Blind 2 02.02.2020","             ","05.02.2020 20_58_3424","2020-02-05 20:58:34","2020-02-05"," 20:58:34"
"Blind_2_02.02.2020","0","02/02/2020",100,NA,10,20,"","Blind 2 02.02.2020","blind",1854,"20:3n-6","PUFA-KF_05.02.2020 20_58_3424","Blind 2 02.02.2020","             ","05.02.2020 20_58_3424","2020-02-05 20:58:34","2020-02-05"," 20:58:34"
"Blind_2_02.02.2020","0","02/02/2020",100,NA,10,20,"","Blind 2 02.02.2020","blind",10695,"20:4n-6","PUFA-KF_05.02.2020 20_58_3424","Blind 2 02.02.2020","             ","05.02.2020 20_58_3424","2020-02-05 20:58:34","2020-02-05"," 20:58:34"
"Blind_2_02.02.2020","0","02/02/2020",100,NA,10,20,"","Blind 2 02.02.2020","blind",3804,"21:0","PUFA-KF_05.02.2020 20_58_3424","Blind 2 02.02.2020","             ","05.02.2020 20_58_3424","2020-02-05 20:58:34","2020-02-05"," 20:58:34"
"Blind_2_02.02.2020","0","02/02/2020",100,NA,10,20,"","Blind 2 02.02.2020","blind",4175,"20:3n-3","PUFA-KF_05.02.2020 20_58_3424","Blind 2 02.02.2020","             ","05.02.2020 20_58_3424","2020-02-05 20:58:34","2020-02-05"," 20:58:34"
"Blind_2_02.02.2020","0","02/02/2020",100,NA,10,20,"","Blind 2 02.02.2020","blind",20673,"20:5n-3","PUFA-KF_05.02.2020 20_58_3424","Blind 2 02.02.2020","             ","05.02.2020 20_58_3424","2020-02-05 20:58:34","2020-02-05"," 20:58:34"
"Blind_2_02.02.2020","0","02/02/2020",100,NA,10,20,"","Blind 2 02.02.2020","blind",8082,"22:0","PUFA-KF_05.02.2020 20_58_3424","Blind 2 02.02.2020","             ","05.02.2020 20_58_3424","2020-02-05 20:58:34","2020-02-05"," 20:58:34"
"Blind_2_02.02.2020","0","02/02/2020",100,NA,10,20,"","Blind 2 02.02.2020","blind",4703,"22:1n-9","PUFA-KF_05.02.2020 20_58_3424","Blind 2 02.02.2020","             ","05.02.2020 20_58_3424","2020-02-05 20:58:34","2020-02-05"," 20:58:34"
"Blind_2_02.02.2020","0","02/02/2020",100,NA,10,20,"","Blind 2 02.02.2020","blind",614,"22:2n-6","PUFA-KF_05.02.2020 20_58_3424","Blind 2 02.02.2020","             ","05.02.2020 20_58_3424","2020-02-05 20:58:34","2020-02-05"," 20:58:34"
"Blind_2_02.02.2020","0","02/02/2020",100,NA,10,20,"","Blind 2 02.02.2020","blind",73160,"23:0","PUFA-KF_05.02.2020 20_58_3424","Blind 2 02.02.2020","             ","05.02.2020 20_58_3424","2020-02-05 20:58:34","2020-02-05"," 20:58:34"
"Blind_2_02.02.2020","0","02/02/2020",100,NA,10,20,"","Blind 2 02.02.2020","blind",23708,"22:6n-3","PUFA-KF_05.02.2020 20_58_3424","Blind 2 02.02.2020","             ","05.02.2020 20_58_3424","2020-02-05 20:58:34","2020-02-05"," 20:58:34"
"Blind_2_02.02.2020","0","02/02/2020",100,NA,10,20,"","Blind 2 02.02.2020","blind",369,"24:0","PUFA-KF_05.02.2020 20_58_3424","Blind 2 02.02.2020","             ","05.02.2020 20_58_3424","2020-02-05 20:58:34","2020-02-05"," 20:58:34"
"Blind_2_02.02.2020","0","02/02/2020",100,NA,10,20,"","Blind 2 02.02.2020","blind",638,"24:1n-9","PUFA-KF_05.02.2020 20_58_3424","Blind 2 02.02.2020","             ","05.02.2020 20_58_3424","2020-02-05 20:58:34","2020-02-05"," 20:58:34"
"Blind_1_13.01.2020","0","13/01/2020",50,"15/01/2020",10,20,"","Blind 1 13.01.2020","blind",710,"11:0","PUFA-KF_15.01.2020 14_47_2423","Blind 1 13.01.2020","             ","15.01.2020 14_47_2423","2020-01-15 14:47:24","2020-01-15"," 14:47:24"
"Blind_1_13.01.2020","0","13/01/2020",50,"15/01/2020",10,20,"","Blind 1 13.01.2020","blind",299041,"13:0","PUFA-KF_15.01.2020 14_47_2423","Blind 1 13.01.2020","             ","15.01.2020 14_47_2423","2020-01-15 14:47:24","2020-01-15"," 14:47:24"
"Blind_1_13.01.2020","0","13/01/2020",50,"15/01/2020",10,20,"","Blind 1 13.01.2020","blind",2951,"14:1n-5","PUFA-KF_15.01.2020 14_47_2423","Blind 1 13.01.2020","             ","15.01.2020 14_47_2423","2020-01-15 14:47:24","2020-01-15"," 14:47:24"
"Blind_1_13.01.2020","0","13/01/2020",50,"15/01/2020",10,20,"","Blind 1 13.01.2020","blind",30914,"16:0","PUFA-KF_15.01.2020 14_47_2423","Blind 1 13.01.2020","             ","15.01.2020 14_47_2423","2020-01-15 14:47:24","2020-01-15"," 14:47:24"
"Blind_1_13.01.2020","0","13/01/2020",50,"15/01/2020",10,20,"","Blind 1 13.01.2020","blind",33714,"16:0","PUFA-KF_15.01.2020 14_47_2423","Blind 1 13.01.2020","             ","15.01.2020 14_47_2423","2020-01-15 14:47:24","2020-01-15"," 14:47:24"
"Blind_1_13.01.2020","0","13/01/2020",50,"15/01/2020",10,20,"","Blind 1 13.01.2020","blind",471709,"17:0","PUFA-KF_15.01.2020 14_47_2423","Blind 1 13.01.2020","             ","15.01.2020 14_47_2423","2020-01-15 14:47:24","2020-01-15"," 14:47:24"
"Blind_1_13.01.2020","0","13/01/2020",50,"15/01/2020",10,20,"","Blind 1 13.01.2020","blind",6198,"17:1n-7","PUFA-KF_15.01.2020 14_47_2423","Blind 1 13.01.2020","             ","15.01.2020 14_47_2423","2020-01-15 14:47:24","2020-01-15"," 14:47:24"
"Blind_1_13.01.2020","0","13/01/2020",50,"15/01/2020",10,20,"","Blind 1 13.01.2020","blind",4228026,"18:0","PUFA-KF_15.01.2020 14_47_2423","Blind 1 13.01.2020","             ","15.01.2020 14_47_2423","2020-01-15 14:47:24","2020-01-15"," 14:47:24"
"Blind_1_13.01.2020","0","13/01/2020",50,"15/01/2020",10,20,"","Blind 1 13.01.2020","blind",796052,"18:1n-9c","PUFA-KF_15.01.2020 14_47_2423","Blind 1 13.01.2020","             ","15.01.2020 14_47_2423","2020-01-15 14:47:24","2020-01-15"," 14:47:24"
"Blind_1_13.01.2020","0","13/01/2020",50,"15/01/2020",10,20,"","Blind 1 13.01.2020","blind",599168,"18:1n-7","PUFA-KF_15.01.2020 14_47_2423","Blind 1 13.01.2020","             ","15.01.2020 14_47_2423","2020-01-15 14:47:24","2020-01-15"," 14:47:24"
"Blind_1_13.01.2020","0","13/01/2020",50,"15/01/2020",10,20,"","Blind 1 13.01.2020","blind",352789,"18:2n-6t","PUFA-KF_15.01.2020 14_47_2423","Blind 1 13.01.2020","             ","15.01.2020 14_47_2423","2020-01-15 14:47:24","2020-01-15"," 14:47:24"
"Blind_1_13.01.2020","0","13/01/2020",50,"15/01/2020",10,20,"","Blind 1 13.01.2020","blind",1207,"18:3n-6","PUFA-KF_15.01.2020 14_47_2423","Blind 1 13.01.2020","             ","15.01.2020 14_47_2423","2020-01-15 14:47:24","2020-01-15"," 14:47:24"
"Blind_1_13.01.2020","0","13/01/2020",50,"15/01/2020",10,20,"","Blind 1 13.01.2020","blind",34930,"18:3n-3","PUFA-KF_15.01.2020 14_47_2423","Blind 1 13.01.2020","             ","15.01.2020 14_47_2423","2020-01-15 14:47:24","2020-01-15"," 14:47:24"
"Blind_1_13.01.2020","0","13/01/2020",50,"15/01/2020",10,20,"","Blind 1 13.01.2020","blind",109844,"20:0","PUFA-KF_15.01.2020 14_47_2423","Blind 1 13.01.2020","             ","15.01.2020 14_47_2423","2020-01-15 14:47:24","2020-01-15"," 14:47:24"
"Blind_1_13.01.2020","0","13/01/2020",50,"15/01/2020",10,20,"","Blind 1 13.01.2020","blind",24462,"20:1n-9","PUFA-KF_15.01.2020 14_47_2423","Blind 1 13.01.2020","             ","15.01.2020 14_47_2423","2020-01-15 14:47:24","2020-01-15"," 14:47:24"
"Blind_1_13.01.2020","0","13/01/2020",50,"15/01/2020",10,20,"","Blind 1 13.01.2020","blind",12992,"20:3n-6","PUFA-KF_15.01.2020 14_47_2423","Blind 1 13.01.2020","             ","15.01.2020 14_47_2423","2020-01-15 14:47:24","2020-01-15"," 14:47:24"
"Blind_1_13.01.2020","0","13/01/2020",50,"15/01/2020",10,20,"","Blind 1 13.01.2020","blind",329,"20:4n-6","PUFA-KF_15.01.2020 14_47_2423","Blind 1 13.01.2020","             ","15.01.2020 14_47_2423","2020-01-15 14:47:24","2020-01-15"," 14:47:24"
"Blind_1_13.01.2020","0","13/01/2020",50,"15/01/2020",10,20,"","Blind 1 13.01.2020","blind",537,"21:0","PUFA-KF_15.01.2020 14_47_2423","Blind 1 13.01.2020","             ","15.01.2020 14_47_2423","2020-01-15 14:47:24","2020-01-15"," 14:47:24"
"Blind_1_13.01.2020","0","13/01/2020",50,"15/01/2020",10,20,"","Blind 1 13.01.2020","blind",70220,"20:5n-3","PUFA-KF_15.01.2020 14_47_2423","Blind 1 13.01.2020","             ","15.01.2020 14_47_2423","2020-01-15 14:47:24","2020-01-15"," 14:47:24"
"Blind_1_13.01.2020","0","13/01/2020",50,"15/01/2020",10,20,"","Blind 1 13.01.2020","blind",499,"22:0","PUFA-KF_15.01.2020 14_47_2423","Blind 1 13.01.2020","             ","15.01.2020 14_47_2423","2020-01-15 14:47:24","2020-01-15"," 14:47:24"
"Blind_1_13.01.2020","0","13/01/2020",50,"15/01/2020",10,20,"","Blind 1 13.01.2020","blind",2094625,"23:0","PUFA-KF_15.01.2020 14_47_2423","Blind 1 13.01.2020","             ","15.01.2020 14_47_2423","2020-01-15 14:47:24","2020-01-15"," 14:47:24"
"Blind_1_13.01.2020","0","13/01/2020",50,"15/01/2020",10,20,"","Blind 1 13.01.2020","blind",808,"22:6n-3","PUFA-KF_15.01.2020 14_47_2423","Blind 1 13.01.2020","             ","15.01.2020 14_47_2423","2020-01-15 14:47:24","2020-01-15"," 14:47:24"
"Blind_1_13.01.2020","0","13/01/2020",50,"15/01/2020",10,20,"","Blind 1 13.01.2020","blind",43989,"24:1n-9","PUFA-KF_15.01.2020 14_47_2423","Blind 1 13.01.2020","             ","15.01.2020 14_47_2423","2020-01-15 14:47:24","2020-01-15"," 14:47:24"
"Blind_2_15.01.2020","0","15/01/2020",50,"16/01/2020",10,20,"","Blind 2 15.01.2020","blind",8320,"15:0","PUFA-KF_17.01.2020 00_55_5459","Blind 2 15.01.20120","             ","17.01.2020 00_55_5459","2020-01-17 00:55:54","2020-01-17"," 00:55:54"
"Blind_2_15.01.2020","0","15/01/2020",50,"16/01/2020",10,20,"","Blind 2 15.01.2020","blind",31203,"17:1n-7","PUFA-KF_17.01.2020 00_55_5459","Blind 2 15.01.20120","             ","17.01.2020 00_55_5459","2020-01-17 00:55:54","2020-01-17"," 00:55:54"
"Blind_2_15.01.2020","0","15/01/2020",50,"16/01/2020",10,20,"","Blind 2 15.01.2020","blind",3053,"18:1n-9t","PUFA-KF_17.01.2020 00_55_5459","Blind 2 15.01.20120","             ","17.01.2020 00_55_5459","2020-01-17 00:55:54","2020-01-17"," 00:55:54"
"Blind_2_15.01.2020","0","15/01/2020",50,"16/01/2020",10,20,"","Blind 2 15.01.2020","blind",21590,"18:1n-7","PUFA-KF_17.01.2020 00_55_5459","Blind 2 15.01.20120","             ","17.01.2020 00_55_5459","2020-01-17 00:55:54","2020-01-17"," 00:55:54"
"Blind_2_15.01.2020","0","15/01/2020",50,"16/01/2020",10,20,"","Blind 2 15.01.2020","blind",175968,"18:2n-6t","PUFA-KF_17.01.2020 00_55_5459","Blind 2 15.01.20120","             ","17.01.2020 00_55_5459","2020-01-17 00:55:54","2020-01-17"," 00:55:54"
"Blind_2_15.01.2020","0","15/01/2020",50,"16/01/2020",10,20,"","Blind 2 15.01.2020","blind",373,"18:2n-6c","PUFA-KF_17.01.2020 00_55_5459","Blind 2 15.01.20120","             ","17.01.2020 00_55_5459","2020-01-17 00:55:54","2020-01-17"," 00:55:54"
"Blind_2_15.01.2020","0","15/01/2020",50,"16/01/2020",10,20,"","Blind 2 15.01.2020","blind",33410,"18:3n-6","PUFA-KF_17.01.2020 00_55_5459","Blind 2 15.01.20120","             ","17.01.2020 00_55_5459","2020-01-17 00:55:54","2020-01-17"," 00:55:54"
"Blind_2_15.01.2020","0","15/01/2020",50,"16/01/2020",10,20,"","Blind 2 15.01.2020","blind",480,"18:3n-3","PUFA-KF_17.01.2020 00_55_5459","Blind 2 15.01.20120","             ","17.01.2020 00_55_5459","2020-01-17 00:55:54","2020-01-17"," 00:55:54"
"Blind_2_15.01.2020","0","15/01/2020",50,"16/01/2020",10,20,"","Blind 2 15.01.2020","blind",9161,"20:0","PUFA-KF_17.01.2020 00_55_5459","Blind 2 15.01.20120","             ","17.01.2020 00_55_5459","2020-01-17 00:55:54","2020-01-17"," 00:55:54"
"Blind_2_15.01.2020","0","15/01/2020",50,"16/01/2020",10,20,"","Blind 2 15.01.2020","blind",63011,"20:1n-9","PUFA-KF_17.01.2020 00_55_5459","Blind 2 15.01.20120","             ","17.01.2020 00_55_5459","2020-01-17 00:55:54","2020-01-17"," 00:55:54"
"Blind_2_15.01.2020","0","15/01/2020",50,"16/01/2020",10,20,"","Blind 2 15.01.2020","blind",1751,"20:2n-6","PUFA-KF_17.01.2020 00_55_5459","Blind 2 15.01.20120","             ","17.01.2020 00_55_5459","2020-01-17 00:55:54","2020-01-17"," 00:55:54"
"Blind_2_15.01.2020","0","15/01/2020",50,"16/01/2020",10,20,"","Blind 2 15.01.2020","blind",13367,"20:3n-6","PUFA-KF_17.01.2020 00_55_5459","Blind 2 15.01.20120","             ","17.01.2020 00_55_5459","2020-01-17 00:55:54","2020-01-17"," 00:55:54"
"Blind_2_15.01.2020","0","15/01/2020",50,"16/01/2020",10,20,"","Blind 2 15.01.2020","blind",839,"20:4n-6","PUFA-KF_17.01.2020 00_55_5459","Blind 2 15.01.20120","             ","17.01.2020 00_55_5459","2020-01-17 00:55:54","2020-01-17"," 00:55:54"
"Blind_2_15.01.2020","0","15/01/2020",50,"16/01/2020",10,20,"","Blind 2 15.01.2020","blind",1820,"21:0","PUFA-KF_17.01.2020 00_55_5459","Blind 2 15.01.20120","             ","17.01.2020 00_55_5459","2020-01-17 00:55:54","2020-01-17"," 00:55:54"
"Blind_2_15.01.2020","0","15/01/2020",50,"16/01/2020",10,20,"","Blind 2 15.01.2020","blind",506,"20:3n-3","PUFA-KF_17.01.2020 00_55_5459","Blind 2 15.01.20120","             ","17.01.2020 00_55_5459","2020-01-17 00:55:54","2020-01-17"," 00:55:54"
"Blind_2_15.01.2020","0","15/01/2020",50,"16/01/2020",10,20,"","Blind 2 15.01.2020","blind",23544,"20:5n-3","PUFA-KF_17.01.2020 00_55_5459","Blind 2 15.01.20120","             ","17.01.2020 00_55_5459","2020-01-17 00:55:54","2020-01-17"," 00:55:54"
"Blind_2_15.01.2020","0","15/01/2020",50,"16/01/2020",10,20,"","Blind 2 15.01.2020","blind",30754,"22:0","PUFA-KF_17.01.2020 00_55_5459","Blind 2 15.01.20120","             ","17.01.2020 00_55_5459","2020-01-17 00:55:54","2020-01-17"," 00:55:54"
"Blind_2_15.01.2020","0","15/01/2020",50,"16/01/2020",10,20,"","Blind 2 15.01.2020","blind",833,"22:1n-9","PUFA-KF_17.01.2020 00_55_5459","Blind 2 15.01.20120","             ","17.01.2020 00_55_5459","2020-01-17 00:55:54","2020-01-17"," 00:55:54"
"Blind_2_15.01.2020","0","15/01/2020",50,"16/01/2020",10,20,"","Blind 2 15.01.2020","blind",458,"22:2n-6","PUFA-KF_17.01.2020 00_55_5459","Blind 2 15.01.20120","             ","17.01.2020 00_55_5459","2020-01-17 00:55:54","2020-01-17"," 00:55:54"
"Blind_2_15.01.2020","0","15/01/2020",50,"16/01/2020",10,20,"","Blind 2 15.01.2020","blind",13677,"23:0","PUFA-KF_17.01.2020 00_55_5459","Blind 2 15.01.20120","             ","17.01.2020 00_55_5459","2020-01-17 00:55:54","2020-01-17"," 00:55:54"
"Blind_2_15.01.2020","0","15/01/2020",50,"16/01/2020",10,20,"","Blind 2 15.01.2020","blind",1148,"22:6n-3","PUFA-KF_17.01.2020 00_55_5459","Blind 2 15.01.20120","             ","17.01.2020 00_55_5459","2020-01-17 00:55:54","2020-01-17"," 00:55:54"
"Blind_2_15.01.2020","0","15/01/2020",50,"16/01/2020",10,20,"","Blind 2 15.01.2020","blind",1577,"24:0","PUFA-KF_17.01.2020 00_55_5459","Blind 2 15.01.20120","             ","17.01.2020 00_55_5459","2020-01-17 00:55:54","2020-01-17"," 00:55:54"
"Blind_2_15.01.2020","0","15/01/2020",50,"16/01/2020",10,20,"","Blind 2 15.01.2020","blind",7705,"24:1n-9","PUFA-KF_17.01.2020 00_55_5459","Blind 2 15.01.20120","             ","17.01.2020 00_55_5459","2020-01-17 00:55:54","2020-01-17"," 00:55:54"
"Blind_1_15.01.2020","0","15/01/2020",50,"17/01/2020",10,20,"","Blind 1 15.01.2020","blind",2873,"12:0","PUFA-KF_17.01.2020 14_08_551","Blind 1 15.01.2020","             ","17.01.2020 14_08_551","2020-01-17 14:08:55","2020-01-17"," 14:08:55"
"Blind_1_15.01.2020","0","15/01/2020",50,"17/01/2020",10,20,"","Blind 1 15.01.2020","blind",6923,"13:0","PUFA-KF_17.01.2020 14_08_551","Blind 1 15.01.2020","             ","17.01.2020 14_08_551","2020-01-17 14:08:55","2020-01-17"," 14:08:55"
"Blind_1_15.01.2020","0","15/01/2020",50,"17/01/2020",10,20,"","Blind 1 15.01.2020","blind",5127,"14:0","PUFA-KF_17.01.2020 14_08_551","Blind 1 15.01.2020","             ","17.01.2020 14_08_551","2020-01-17 14:08:55","2020-01-17"," 14:08:55"
"Blind_1_15.01.2020","0","15/01/2020",50,"17/01/2020",10,20,"","Blind 1 15.01.2020","blind",21429,"14:1n-5","PUFA-KF_17.01.2020 14_08_551","Blind 1 15.01.2020","             ","17.01.2020 14_08_551","2020-01-17 14:08:55","2020-01-17"," 14:08:55"
"Blind_1_15.01.2020","0","15/01/2020",50,"17/01/2020",10,20,"","Blind 1 15.01.2020","blind",26629,"15:0","PUFA-KF_17.01.2020 14_08_551","Blind 1 15.01.2020","             ","17.01.2020 14_08_551","2020-01-17 14:08:55","2020-01-17"," 14:08:55"
"Blind_1_15.01.2020","0","15/01/2020",50,"17/01/2020",10,20,"","Blind 1 15.01.2020","blind",4954,"15:1n-5","PUFA-KF_17.01.2020 14_08_551","Blind 1 15.01.2020","             ","17.01.2020 14_08_551","2020-01-17 14:08:55","2020-01-17"," 14:08:55"
"Blind_1_15.01.2020","0","15/01/2020",50,"17/01/2020",10,20,"","Blind 1 15.01.2020","blind",2058,"16:0","PUFA-KF_17.01.2020 14_08_551","Blind 1 15.01.2020","             ","17.01.2020 14_08_551","2020-01-17 14:08:55","2020-01-17"," 14:08:55"
"Blind_1_15.01.2020","0","15/01/2020",50,"17/01/2020",10,20,"","Blind 1 15.01.2020","blind",67504,"17:1n-7","PUFA-KF_17.01.2020 14_08_551","Blind 1 15.01.2020","             ","17.01.2020 14_08_551","2020-01-17 14:08:55","2020-01-17"," 14:08:55"
"Blind_1_15.01.2020","0","15/01/2020",50,"17/01/2020",10,20,"","Blind 1 15.01.2020","blind",1782,"18:0","PUFA-KF_17.01.2020 14_08_551","Blind 1 15.01.2020","             ","17.01.2020 14_08_551","2020-01-17 14:08:55","2020-01-17"," 14:08:55"
"Blind_1_15.01.2020","0","15/01/2020",50,"17/01/2020",10,20,"","Blind 1 15.01.2020","blind",36271,"18:1n-9t","PUFA-KF_17.01.2020 14_08_551","Blind 1 15.01.2020","             ","17.01.2020 14_08_551","2020-01-17 14:08:55","2020-01-17"," 14:08:55"
"Blind_1_15.01.2020","0","15/01/2020",50,"17/01/2020",10,20,"","Blind 1 15.01.2020","blind",346809,"18:1n-9c","PUFA-KF_17.01.2020 14_08_551","Blind 1 15.01.2020","             ","17.01.2020 14_08_551","2020-01-17 14:08:55","2020-01-17"," 14:08:55"
"Blind_1_15.01.2020","0","15/01/2020",50,"17/01/2020",10,20,"","Blind 1 15.01.2020","blind",34793,"18:1n-7","PUFA-KF_17.01.2020 14_08_551","Blind 1 15.01.2020","             ","17.01.2020 14_08_551","2020-01-17 14:08:55","2020-01-17"," 14:08:55"
"Blind_1_15.01.2020","0","15/01/2020",50,"17/01/2020",10,20,"","Blind 1 15.01.2020","blind",298274,"18:2n-6t","PUFA-KF_17.01.2020 14_08_551","Blind 1 15.01.2020","             ","17.01.2020 14_08_551","2020-01-17 14:08:55","2020-01-17"," 14:08:55"
"Blind_1_15.01.2020","0","15/01/2020",50,"17/01/2020",10,20,"","Blind 1 15.01.2020","blind",885,"18:2n-6c","PUFA-KF_17.01.2020 14_08_551","Blind 1 15.01.2020","             ","17.01.2020 14_08_551","2020-01-17 14:08:55","2020-01-17"," 14:08:55"
"Blind_1_15.01.2020","0","15/01/2020",50,"17/01/2020",10,20,"","Blind 1 15.01.2020","blind",14362,"18:3n-6","PUFA-KF_17.01.2020 14_08_551","Blind 1 15.01.2020","             ","17.01.2020 14_08_551","2020-01-17 14:08:55","2020-01-17"," 14:08:55"
"Blind_1_15.01.2020","0","15/01/2020",50,"17/01/2020",10,20,"","Blind 1 15.01.2020","blind",1357,"18:3n-3","PUFA-KF_17.01.2020 14_08_551","Blind 1 15.01.2020","             ","17.01.2020 14_08_551","2020-01-17 14:08:55","2020-01-17"," 14:08:55"
"Blind_1_15.01.2020","0","15/01/2020",50,"17/01/2020",10,20,"","Blind 1 15.01.2020","blind",45958,"20:0","PUFA-KF_17.01.2020 14_08_551","Blind 1 15.01.2020","             ","17.01.2020 14_08_551","2020-01-17 14:08:55","2020-01-17"," 14:08:55"
"Blind_1_15.01.2020","0","15/01/2020",50,"17/01/2020",10,20,"","Blind 1 15.01.2020","blind",41341,"20:1n-9","PUFA-KF_17.01.2020 14_08_551","Blind 1 15.01.2020","             ","17.01.2020 14_08_551","2020-01-17 14:08:55","2020-01-17"," 14:08:55"
"Blind_1_15.01.2020","0","15/01/2020",50,"17/01/2020",10,20,"","Blind 1 15.01.2020","blind",15755,"20:2n-6","PUFA-KF_17.01.2020 14_08_551","Blind 1 15.01.2020","             ","17.01.2020 14_08_551","2020-01-17 14:08:55","2020-01-17"," 14:08:55"
"Blind_1_15.01.2020","0","15/01/2020",50,"17/01/2020",10,20,"","Blind 1 15.01.2020","blind",15845,"20:3n-6","PUFA-KF_17.01.2020 14_08_551","Blind 1 15.01.2020","             ","17.01.2020 14_08_551","2020-01-17 14:08:55","2020-01-17"," 14:08:55"
"Blind_1_15.01.2020","0","15/01/2020",50,"17/01/2020",10,20,"","Blind 1 15.01.2020","blind",1117,"21:0","PUFA-KF_17.01.2020 14_08_551","Blind 1 15.01.2020","             ","17.01.2020 14_08_551","2020-01-17 14:08:55","2020-01-17"," 14:08:55"
"Blind_1_15.01.2020","0","15/01/2020",50,"17/01/2020",10,20,"","Blind 1 15.01.2020","blind",34214,"20:5n-3","PUFA-KF_17.01.2020 14_08_551","Blind 1 15.01.2020","             ","17.01.2020 14_08_551","2020-01-17 14:08:55","2020-01-17"," 14:08:55"
"Blind_1_15.01.2020","0","15/01/2020",50,"17/01/2020",10,20,"","Blind 1 15.01.2020","blind",19872,"22:0","PUFA-KF_17.01.2020 14_08_551","Blind 1 15.01.2020","             ","17.01.2020 14_08_551","2020-01-17 14:08:55","2020-01-17"," 14:08:55"
"Blind_1_15.01.2020","0","15/01/2020",50,"17/01/2020",10,20,"","Blind 1 15.01.2020","blind",27855,"22:1n-9","PUFA-KF_17.01.2020 14_08_551","Blind 1 15.01.2020","             ","17.01.2020 14_08_551","2020-01-17 14:08:55","2020-01-17"," 14:08:55"
"Blind_1_15.01.2020","0","15/01/2020",50,"17/01/2020",10,20,"","Blind 1 15.01.2020","blind",8077,"22:2n-6","PUFA-KF_17.01.2020 14_08_551","Blind 1 15.01.2020","             ","17.01.2020 14_08_551","2020-01-17 14:08:55","2020-01-17"," 14:08:55"
"Blind_1_15.01.2020","0","15/01/2020",50,"17/01/2020",10,20,"","Blind 1 15.01.2020","blind",73167,"23:0","PUFA-KF_17.01.2020 14_08_551","Blind 1 15.01.2020","             ","17.01.2020 14_08_551","2020-01-17 14:08:55","2020-01-17"," 14:08:55"
"Blind_1_14.01.2020","0","14/01/2020",50,"18/01/2020",10,20,"","Blind 1 14.01.2020","blind",17728,"18:2n-6c","PUFA-KF_19.01.2020 01_46_1320","Blind 1 14.01.2020","             ","19.01.2020 01_46_1320","2020-01-19 01:46:13","2020-01-19"," 01:46:13"
"Blind_1_14.01.2020","0","14/01/2020",50,"18/01/2020",10,20,"","Blind 1 14.01.2020","blind",154466,"16:1n-7","PUFA-KF_19.01.2020 01_46_1320","Blind 1 14.01.2020","             ","19.01.2020 01_46_1320","2020-01-19 01:46:13","2020-01-19"," 01:46:13"
"Blind_1_14.01.2020","0","14/01/2020",50,"18/01/2020",10,20,"","Blind 1 14.01.2020","blind",40294,"17:0","PUFA-KF_19.01.2020 01_46_1320","Blind 1 14.01.2020","             ","19.01.2020 01_46_1320","2020-01-19 01:46:13","2020-01-19"," 01:46:13"
"Blind_1_14.01.2020","0","14/01/2020",50,"18/01/2020",10,20,"","Blind 1 14.01.2020","blind",265574,"18:1n-9c","PUFA-KF_19.01.2020 01_46_1320","Blind 1 14.01.2020","             ","19.01.2020 01_46_1320","2020-01-19 01:46:13","2020-01-19"," 01:46:13"
"Blind_1_14.01.2020","0","14/01/2020",50,"18/01/2020",10,20,"","Blind 1 14.01.2020","blind",41068,"18:1n-7","PUFA-KF_19.01.2020 01_46_1320","Blind 1 14.01.2020","             ","19.01.2020 01_46_1320","2020-01-19 01:46:13","2020-01-19"," 01:46:13"
"Blind_1_14.01.2020","0","14/01/2020",50,"18/01/2020",10,20,"","Blind 1 14.01.2020","blind",157,"18:2n-6t","PUFA-KF_19.01.2020 01_46_1320","Blind 1 14.01.2020","             ","19.01.2020 01_46_1320","2020-01-19 01:46:13","2020-01-19"," 01:46:13"
"Blind_1_14.01.2020","0","14/01/2020",50,"18/01/2020",10,20,"","Blind 1 14.01.2020","blind",58597,"18:3n-6","PUFA-KF_19.01.2020 01_46_1320","Blind 1 14.01.2020","             ","19.01.2020 01_46_1320","2020-01-19 01:46:13","2020-01-19"," 01:46:13"
"Blind_1_14.01.2020","0","14/01/2020",50,"18/01/2020",10,20,"","Blind 1 14.01.2020","blind",665,"18:3n-3","PUFA-KF_19.01.2020 01_46_1320","Blind 1 14.01.2020","             ","19.01.2020 01_46_1320","2020-01-19 01:46:13","2020-01-19"," 01:46:13"
"Blind_1_14.01.2020","0","14/01/2020",50,"18/01/2020",10,20,"","Blind 1 14.01.2020","blind",8581,"20:0","PUFA-KF_19.01.2020 01_46_1320","Blind 1 14.01.2020","             ","19.01.2020 01_46_1320","2020-01-19 01:46:13","2020-01-19"," 01:46:13"
"Blind_1_14.01.2020","0","14/01/2020",50,"18/01/2020",10,20,"","Blind 1 14.01.2020","blind",1120,"20:1n-9","PUFA-KF_19.01.2020 01_46_1320","Blind 1 14.01.2020","             ","19.01.2020 01_46_1320","2020-01-19 01:46:13","2020-01-19"," 01:46:13"
"Blind_1_14.01.2020","0","14/01/2020",50,"18/01/2020",10,20,"","Blind 1 14.01.2020","blind",31235,"20:2n-6","PUFA-KF_19.01.2020 01_46_1320","Blind 1 14.01.2020","             ","19.01.2020 01_46_1320","2020-01-19 01:46:13","2020-01-19"," 01:46:13"
"Blind_1_14.01.2020","0","14/01/2020",50,"18/01/2020",10,20,"","Blind 1 14.01.2020","blind",395,"20:3n-6","PUFA-KF_19.01.2020 01_46_1320","Blind 1 14.01.2020","             ","19.01.2020 01_46_1320","2020-01-19 01:46:13","2020-01-19"," 01:46:13"
"Blind_1_14.01.2020","0","14/01/2020",50,"18/01/2020",10,20,"","Blind 1 14.01.2020","blind",438,"20:4n-6","PUFA-KF_19.01.2020 01_46_1320","Blind 1 14.01.2020","             ","19.01.2020 01_46_1320","2020-01-19 01:46:13","2020-01-19"," 01:46:13"
"Blind_1_14.01.2020","0","14/01/2020",50,"18/01/2020",10,20,"","Blind 1 14.01.2020","blind",679,"21:0","PUFA-KF_19.01.2020 01_46_1320","Blind 1 14.01.2020","             ","19.01.2020 01_46_1320","2020-01-19 01:46:13","2020-01-19"," 01:46:13"
"Blind_1_14.01.2020","0","14/01/2020",50,"18/01/2020",10,20,"","Blind 1 14.01.2020","blind",34794,"20:3n-3","PUFA-KF_19.01.2020 01_46_1320","Blind 1 14.01.2020","             ","19.01.2020 01_46_1320","2020-01-19 01:46:13","2020-01-19"," 01:46:13"
"Blind_1_14.01.2020","0","14/01/2020",50,"18/01/2020",10,20,"","Blind 1 14.01.2020","blind",837,"20:5n-3","PUFA-KF_19.01.2020 01_46_1320","Blind 1 14.01.2020","             ","19.01.2020 01_46_1320","2020-01-19 01:46:13","2020-01-19"," 01:46:13"
"Blind_1_14.01.2020","0","14/01/2020",50,"18/01/2020",10,20,"","Blind 1 14.01.2020","blind",1413,"22:0","PUFA-KF_19.01.2020 01_46_1320","Blind 1 14.01.2020","             ","19.01.2020 01_46_1320","2020-01-19 01:46:13","2020-01-19"," 01:46:13"
"Blind_1_14.01.2020","0","14/01/2020",50,"18/01/2020",10,20,"","Blind 1 14.01.2020","blind",8102,"22:1n-9","PUFA-KF_19.01.2020 01_46_1320","Blind 1 14.01.2020","             ","19.01.2020 01_46_1320","2020-01-19 01:46:13","2020-01-19"," 01:46:13"
"Blind_1_14.01.2020","0","14/01/2020",50,"18/01/2020",10,20,"","Blind 1 14.01.2020","blind",396,"22:2n-6","PUFA-KF_19.01.2020 01_46_1320","Blind 1 14.01.2020","             ","19.01.2020 01_46_1320","2020-01-19 01:46:13","2020-01-19"," 01:46:13"
"Blind_1_14.01.2020","0","14/01/2020",50,"18/01/2020",10,20,"","Blind 1 14.01.2020","blind",793,"24:0","PUFA-KF_19.01.2020 01_46_1320","Blind 1 14.01.2020","             ","19.01.2020 01_46_1320","2020-01-19 01:46:13","2020-01-19"," 01:46:13"
"Blind_2_14.01.2020","0","14/01/2020",50,"18/01/2020",10,20,"","Blind 2 14.01.2020","blind",471492,"16:1n-7","PUFA-KF_19.01.2020 06_24_2325","Blind 2 14.01.2020","             ","19.01.2020 06_24_2325","2020-01-19 06:24:23","2020-01-19"," 06:24:23"
"Blind_2_14.01.2020","0","14/01/2020",50,"18/01/2020",10,20,"","Blind 2 14.01.2020","blind",57702,"17:0","PUFA-KF_19.01.2020 06_24_2325","Blind 2 14.01.2020","             ","19.01.2020 06_24_2325","2020-01-19 06:24:23","2020-01-19"," 06:24:23"
"Blind_2_14.01.2020","0","14/01/2020",50,"18/01/2020",10,20,"","Blind 2 14.01.2020","blind",4159,"17:1n-7","PUFA-KF_19.01.2020 06_24_2325","Blind 2 14.01.2020","             ","19.01.2020 06_24_2325","2020-01-19 06:24:23","2020-01-19"," 06:24:23"
"Blind_2_14.01.2020","0","14/01/2020",50,"18/01/2020",10,20,"","Blind 2 14.01.2020","blind",463913,"18:1n-9c","PUFA-KF_19.01.2020 06_24_2325","Blind 2 14.01.2020","             ","19.01.2020 06_24_2325","2020-01-19 06:24:23","2020-01-19"," 06:24:23"
"Blind_2_14.01.2020","0","14/01/2020",50,"18/01/2020",10,20,"","Blind 2 14.01.2020","blind",113849,"18:1n-7","PUFA-KF_19.01.2020 06_24_2325","Blind 2 14.01.2020","             ","19.01.2020 06_24_2325","2020-01-19 06:24:23","2020-01-19"," 06:24:23"
"Blind_2_14.01.2020","0","14/01/2020",50,"18/01/2020",10,20,"","Blind 2 14.01.2020","blind",1169,"18:2n-6t","PUFA-KF_19.01.2020 06_24_2325","Blind 2 14.01.2020","             ","19.01.2020 06_24_2325","2020-01-19 06:24:23","2020-01-19"," 06:24:23"
"Blind_2_14.01.2020","0","14/01/2020",50,"18/01/2020",10,20,"","Blind 2 14.01.2020","blind",51908,"18:2n-6c","PUFA-KF_19.01.2020 06_24_2325","Blind 2 14.01.2020","             ","19.01.2020 06_24_2325","2020-01-19 06:24:23","2020-01-19"," 06:24:23"
"Blind_2_14.01.2020","0","14/01/2020",50,"18/01/2020",10,20,"","Blind 2 14.01.2020","blind",48593,"18:3n-6","PUFA-KF_19.01.2020 06_24_2325","Blind 2 14.01.2020","             ","19.01.2020 06_24_2325","2020-01-19 06:24:23","2020-01-19"," 06:24:23"
"Blind_2_14.01.2020","0","14/01/2020",50,"18/01/2020",10,20,"","Blind 2 14.01.2020","blind",4368,"20:0","PUFA-KF_19.01.2020 06_24_2325","Blind 2 14.01.2020","             ","19.01.2020 06_24_2325","2020-01-19 06:24:23","2020-01-19"," 06:24:23"
"Blind_2_14.01.2020","0","14/01/2020",50,"18/01/2020",10,20,"","Blind 2 14.01.2020","blind",401,"20:1n-9","PUFA-KF_19.01.2020 06_24_2325","Blind 2 14.01.2020","             ","19.01.2020 06_24_2325","2020-01-19 06:24:23","2020-01-19"," 06:24:23"
"Blind_2_14.01.2020","0","14/01/2020",50,"18/01/2020",10,20,"","Blind 2 14.01.2020","blind",35464,"20:2n-6","PUFA-KF_19.01.2020 06_24_2325","Blind 2 14.01.2020","             ","19.01.2020 06_24_2325","2020-01-19 06:24:23","2020-01-19"," 06:24:23"
"Blind_2_14.01.2020","0","14/01/2020",50,"18/01/2020",10,20,"","Blind 2 14.01.2020","blind",372,"20:3n-6","PUFA-KF_19.01.2020 06_24_2325","Blind 2 14.01.2020","             ","19.01.2020 06_24_2325","2020-01-19 06:24:23","2020-01-19"," 06:24:23"
"Blind_2_14.01.2020","0","14/01/2020",50,"18/01/2020",10,20,"","Blind 2 14.01.2020","blind",552,"20:4n-6","PUFA-KF_19.01.2020 06_24_2325","Blind 2 14.01.2020","             ","19.01.2020 06_24_2325","2020-01-19 06:24:23","2020-01-19"," 06:24:23"
"Blind_2_14.01.2020","0","14/01/2020",50,"18/01/2020",10,20,"","Blind 2 14.01.2020","blind",240,"21:0","PUFA-KF_19.01.2020 06_24_2325","Blind 2 14.01.2020","             ","19.01.2020 06_24_2325","2020-01-19 06:24:23","2020-01-19"," 06:24:23"
"Blind_2_14.01.2020","0","14/01/2020",50,"18/01/2020",10,20,"","Blind 2 14.01.2020","blind",36854,"20:3n-3","PUFA-KF_19.01.2020 06_24_2325","Blind 2 14.01.2020","             ","19.01.2020 06_24_2325","2020-01-19 06:24:23","2020-01-19"," 06:24:23"
"Blind_2_14.01.2020","0","14/01/2020",50,"18/01/2020",10,20,"","Blind 2 14.01.2020","blind",6592,"20:5n-3","PUFA-KF_19.01.2020 06_24_2325","Blind 2 14.01.2020","             ","19.01.2020 06_24_2325","2020-01-19 06:24:23","2020-01-19"," 06:24:23"
"Blind_2_14.01.2020","0","14/01/2020",50,"18/01/2020",10,20,"","Blind 2 14.01.2020","blind",2238,"22:0","PUFA-KF_19.01.2020 06_24_2325","Blind 2 14.01.2020","             ","19.01.2020 06_24_2325","2020-01-19 06:24:23","2020-01-19"," 06:24:23"
"Blind_2_14.01.2020","0","14/01/2020",50,"18/01/2020",10,20,"","Blind 2 14.01.2020","blind",10246,"22:1n-9","PUFA-KF_19.01.2020 06_24_2325","Blind 2 14.01.2020","             ","19.01.2020 06_24_2325","2020-01-19 06:24:23","2020-01-19"," 06:24:23"
"Blind_2_14.01.2020","0","14/01/2020",50,"18/01/2020",10,20,"","Blind 2 14.01.2020","blind",974,"23:0","PUFA-KF_19.01.2020 06_24_2325","Blind 2 14.01.2020","             ","19.01.2020 06_24_2325","2020-01-19 06:24:23","2020-01-19"," 06:24:23"
"Blind_2_14.01.2020","0","14/01/2020",50,"18/01/2020",10,20,"","Blind 2 14.01.2020","blind",576,"22:6n-3","PUFA-KF_19.01.2020 06_24_2325","Blind 2 14.01.2020","             ","19.01.2020 06_24_2325","2020-01-19 06:24:23","2020-01-19"," 06:24:23"
"Blind_2_14.01.2020","0","14/01/2020",50,"18/01/2020",10,20,"","Blind 2 14.01.2020","blind",341,"24:0","PUFA-KF_19.01.2020 06_24_2325","Blind 2 14.01.2020","             ","19.01.2020 06_24_2325","2020-01-19 06:24:23","2020-01-19"," 06:24:23"
"Blind_2_14.01.2020","0","14/01/2020",50,"18/01/2020",10,20,"","Blind 2 14.01.2020","blind",1140,"24:1n-9","PUFA-KF_19.01.2020 06_24_2325","Blind 2 14.01.2020","             ","19.01.2020 06_24_2325","2020-01-19 06:24:23","2020-01-19"," 06:24:23"
"Blind","0",NA,50,"18/01/2020",10,20,"PUFA-KF_18.01.2020 18_21_0712","Blind","blind",6147,"15:0","PUFA-KF_06.01.2020 23_26_4014","Blind","             ","06.01.2020 23_26_4014","2020-01-06 23:26:40","2020-01-06"," 23:26:40"
"Blind","0",NA,50,"18/01/2020",10,20,"PUFA-KF_18.01.2020 18_21_0712","Blind","blind",211617,"17:0","PUFA-KF_06.01.2020 23_26_4014","Blind","             ","06.01.2020 23_26_4014","2020-01-06 23:26:40","2020-01-06"," 23:26:40"
"Blind","0",NA,50,"18/01/2020",10,20,"PUFA-KF_18.01.2020 18_21_0712","Blind","blind",2660975,"18:0","PUFA-KF_06.01.2020 23_26_4014","Blind","             ","06.01.2020 23_26_4014","2020-01-06 23:26:40","2020-01-06"," 23:26:40"
"Blind","0",NA,50,"18/01/2020",10,20,"PUFA-KF_18.01.2020 18_21_0712","Blind","blind",361549,"18:1n-9c","PUFA-KF_06.01.2020 23_26_4014","Blind","             ","06.01.2020 23_26_4014","2020-01-06 23:26:40","2020-01-06"," 23:26:40"
"Blind","0",NA,50,"18/01/2020",10,20,"PUFA-KF_18.01.2020 18_21_0712","Blind","blind",46683,"18:2n-6c","PUFA-KF_06.01.2020 23_26_4014","Blind","             ","06.01.2020 23_26_4014","2020-01-06 23:26:40","2020-01-06"," 23:26:40"
"Blind","0",NA,50,"18/01/2020",10,20,"PUFA-KF_18.01.2020 18_21_0712","Blind","blind",95422,"20:0","PUFA-KF_06.01.2020 23_26_4014","Blind","             ","06.01.2020 23_26_4014","2020-01-06 23:26:40","2020-01-06"," 23:26:40"
"Blind","0",NA,50,"18/01/2020",10,20,"PUFA-KF_18.01.2020 18_21_0712","Blind","blind",96024,"21:0","PUFA-KF_06.01.2020 23_26_4014","Blind","             ","06.01.2020 23_26_4014","2020-01-06 23:26:40","2020-01-06"," 23:26:40"
"Blind","0",NA,50,"18/01/2020",10,20,"PUFA-KF_18.01.2020 18_21_0712","Blind","blind",76413,"20:5n-3","PUFA-KF_06.01.2020 23_26_4014","Blind","             ","06.01.2020 23_26_4014","2020-01-06 23:26:40","2020-01-06"," 23:26:40"
"Blind","0",NA,50,"18/01/2020",10,20,"PUFA-KF_18.01.2020 18_21_0712","Blind","blind",183588,"22:1n-9","PUFA-KF_06.01.2020 23_26_4014","Blind","             ","06.01.2020 23_26_4014","2020-01-06 23:26:40","2020-01-06"," 23:26:40"
"Blind","0",NA,50,"18/01/2020",10,20,"PUFA-KF_18.01.2020 18_21_0712","Blind","blind",3044021,"23:0","PUFA-KF_06.01.2020 23_26_4014","Blind","             ","06.01.2020 23_26_4014","2020-01-06 23:26:40","2020-01-06"," 23:26:40"
"Blind","0",NA,50,"18/01/2020",10,20,"PUFA-KF_18.01.2020 18_21_0712","Blind","blind",327492,"22:6n-3","PUFA-KF_06.01.2020 23_26_4014","Blind","             ","06.01.2020 23_26_4014","2020-01-06 23:26:40","2020-01-06"," 23:26:40"
"Blind","0",NA,50,"18/01/2020",10,20,"PUFA-KF_18.01.2020 18_21_0712","Blind","blind",122965,"24:0","PUFA-KF_06.01.2020 23_26_4014","Blind","             ","06.01.2020 23_26_4014","2020-01-06 23:26:40","2020-01-06"," 23:26:40"
"Blind","0",NA,50,"18/01/2020",10,20,"PUFA-KF_18.01.2020 18_21_0712","Blind","blind",97013,"24:1n-9","PUFA-KF_06.01.2020 23_26_4014","Blind","             ","06.01.2020 23_26_4014","2020-01-06 23:26:40","2020-01-06"," 23:26:40"
"Blind","0",NA,50,"18/01/2020",10,20,"PUFA-KF_18.01.2020 18_21_0712","Blind","blind",10982,"11:0","PUFA-KF_18.01.2020 18_21_0712","Blind","             ","18.01.2020 18_21_0712","2020-01-18 18:21:07","2020-01-18"," 18:21:07"
"Blind","0",NA,50,"18/01/2020",10,20,"PUFA-KF_18.01.2020 18_21_0712","Blind","blind",342483,"16:1n-7","PUFA-KF_18.01.2020 18_21_0712","Blind","             ","18.01.2020 18_21_0712","2020-01-18 18:21:07","2020-01-18"," 18:21:07"
"Blind","0",NA,50,"18/01/2020",10,20,"PUFA-KF_18.01.2020 18_21_0712","Blind","blind",57557,"17:0","PUFA-KF_18.01.2020 18_21_0712","Blind","             ","18.01.2020 18_21_0712","2020-01-18 18:21:07","2020-01-18"," 18:21:07"
"Blind","0",NA,50,"18/01/2020",10,20,"PUFA-KF_18.01.2020 18_21_0712","Blind","blind",5153,"17:1n-7","PUFA-KF_18.01.2020 18_21_0712","Blind","             ","18.01.2020 18_21_0712","2020-01-18 18:21:07","2020-01-18"," 18:21:07"
"Blind","0",NA,50,"18/01/2020",10,20,"PUFA-KF_18.01.2020 18_21_0712","Blind","blind",528795,"18:1n-9c","PUFA-KF_18.01.2020 18_21_0712","Blind","             ","18.01.2020 18_21_0712","2020-01-18 18:21:07","2020-01-18"," 18:21:07"
"Blind","0",NA,50,"18/01/2020",10,20,"PUFA-KF_18.01.2020 18_21_0712","Blind","blind",100320,"18:1n-7","PUFA-KF_18.01.2020 18_21_0712","Blind","             ","18.01.2020 18_21_0712","2020-01-18 18:21:07","2020-01-18"," 18:21:07"
"Blind","0",NA,50,"18/01/2020",10,20,"PUFA-KF_18.01.2020 18_21_0712","Blind","blind",2723,"20:0","PUFA-KF_18.01.2020 18_21_0712","Blind","             ","18.01.2020 18_21_0712","2020-01-18 18:21:07","2020-01-18"," 18:21:07"
"Blind","0",NA,50,"18/01/2020",10,20,"PUFA-KF_18.01.2020 18_21_0712","Blind","blind",48486,"20:2n-6","PUFA-KF_18.01.2020 18_21_0712","Blind","             ","18.01.2020 18_21_0712","2020-01-18 18:21:07","2020-01-18"," 18:21:07"
"Blind","0",NA,50,"18/01/2020",10,20,"PUFA-KF_18.01.2020 18_21_0712","Blind","blind",35803,"20:4n-6","PUFA-KF_18.01.2020 18_21_0712","Blind","             ","18.01.2020 18_21_0712","2020-01-18 18:21:07","2020-01-18"," 18:21:07"
"Blind","0",NA,50,"18/01/2020",10,20,"PUFA-KF_18.01.2020 18_21_0712","Blind","blind",106658,"20:3n-3","PUFA-KF_18.01.2020 18_21_0712","Blind","             ","18.01.2020 18_21_0712","2020-01-18 18:21:07","2020-01-18"," 18:21:07"
"Blind","0",NA,50,"18/01/2020",10,20,"PUFA-KF_18.01.2020 18_21_0712","Blind","blind",17250,"22:6n-3","PUFA-KF_18.01.2020 18_21_0712","Blind","             ","18.01.2020 18_21_0712","2020-01-18 18:21:07","2020-01-18"," 18:21:07"
"Blind","0",NA,50,"18/01/2020",10,20,"PUFA-KF_18.01.2020 18_21_0712","Blind","blind",77267,"24:1n-9","PUFA-KF_18.01.2020 18_21_0712","Blind","             ","18.01.2020 18_21_0712","2020-01-18 18:21:07","2020-01-18"," 18:21:07"
"Blind_2_27.01.2020","0","27/01/2020",100,NA,10,20,"","Blind 2 27.01.2020","blind",8528,"16:0","PUFA-KF_03.02.2020 00_56_5139","Blind 27.01.2020 100 microL MeOH","microL MeOH            ","03.02.2020 00_56_5139","2020-02-03 00:56:51","2020-02-03"," 00:56:51"
"Blind_2_27.01.2020","0","27/01/2020",100,NA,10,20,"","Blind 2 27.01.2020","blind",748,"20:4n-6","PUFA-KF_03.02.2020 00_56_5139","Blind 27.01.2020 100 microL MeOH","microL MeOH            ","03.02.2020 00_56_5139","2020-02-03 00:56:51","2020-02-03"," 00:56:51"
"Blind_2_27.01.2020","0","27/01/2020",100,NA,10,20,"","Blind 2 27.01.2020","blind",2364,"21:0","PUFA-KF_03.02.2020 00_56_5139","Blind 27.01.2020 100 microL MeOH","microL MeOH            ","03.02.2020 00_56_5139","2020-02-03 00:56:51","2020-02-03"," 00:56:51"
"Blind_2_27.01.2020","0","27/01/2020",100,NA,10,20,"","Blind 2 27.01.2020","blind",1914,"20:3n-3","PUFA-KF_03.02.2020 00_56_5139","Blind 27.01.2020 100 microL MeOH","microL MeOH            ","03.02.2020 00_56_5139","2020-02-03 00:56:51","2020-02-03"," 00:56:51"
"Blind_2_27.01.2020","0","27/01/2020",100,NA,10,20,"","Blind 2 27.01.2020","blind",1375,"22:0","PUFA-KF_03.02.2020 00_56_5139","Blind 27.01.2020 100 microL MeOH","microL MeOH            ","03.02.2020 00_56_5139","2020-02-03 00:56:51","2020-02-03"," 00:56:51"
"Blind_2_27.01.2020","0","27/01/2020",100,NA,10,20,"","Blind 2 27.01.2020","blind",413,"22:1n-9","PUFA-KF_03.02.2020 00_56_5139","Blind 27.01.2020 100 microL MeOH","microL MeOH            ","03.02.2020 00_56_5139","2020-02-03 00:56:51","2020-02-03"," 00:56:51"
"Blind_2_27.01.2020","0","27/01/2020",100,NA,10,20,"","Blind 2 27.01.2020","blind",191,"22:2n-6","PUFA-KF_03.02.2020 00_56_5139","Blind 27.01.2020 100 microL MeOH","microL MeOH            ","03.02.2020 00_56_5139","2020-02-03 00:56:51","2020-02-03"," 00:56:51"
"Blind_2_27.01.2020","0","27/01/2020",100,NA,10,20,"","Blind 2 27.01.2020","blind",2405,"23:0","PUFA-KF_03.02.2020 00_56_5139","Blind 27.01.2020 100 microL MeOH","microL MeOH            ","03.02.2020 00_56_5139","2020-02-03 00:56:51","2020-02-03"," 00:56:51"
"Blind_2_27.01.2020","0","27/01/2020",100,NA,10,20,"","Blind 2 27.01.2020","blind",661,"22:6n-3","PUFA-KF_03.02.2020 00_56_5139","Blind 27.01.2020 100 microL MeOH","microL MeOH            ","03.02.2020 00_56_5139","2020-02-03 00:56:51","2020-02-03"," 00:56:51"
"Blind_2_27.01.2020","0","27/01/2020",100,NA,10,20,"","Blind 2 27.01.2020","blind",101606,"24:0","PUFA-KF_03.02.2020 00_56_5139","Blind 27.01.2020 100 microL MeOH","microL MeOH            ","03.02.2020 00_56_5139","2020-02-03 00:56:51","2020-02-03"," 00:56:51"
"Blind_2_27.01.2020","0","27/01/2020",100,NA,10,20,"","Blind 2 27.01.2020","blind",668,"24:1n-9","PUFA-KF_03.02.2020 00_56_5139","Blind 27.01.2020 100 microL MeOH","microL MeOH            ","03.02.2020 00_56_5139","2020-02-03 00:56:51","2020-02-03"," 00:56:51"
"Blind_26.01.2020","0","26/01/2020",100,NA,10,20,"","Blind 26.01.2020","blind",25611,"12:0","PUFA-KF_01.02.2020 14_01_311","Blind 26.01.2020","             ","01.02.2020 14_01_311","2020-02-01 14:01:31","2020-02-01"," 14:01:31"
"Blind_26.01.2020","0","26/01/2020",100,NA,10,20,"","Blind 26.01.2020","blind",964,"13:0","PUFA-KF_01.02.2020 14_01_311","Blind 26.01.2020","             ","01.02.2020 14_01_311","2020-02-01 14:01:31","2020-02-01"," 14:01:31"
"Blind_26.01.2020","0","26/01/2020",100,NA,10,20,"","Blind 26.01.2020","blind",2911,"14:1n-5","PUFA-KF_01.02.2020 14_01_311","Blind 26.01.2020","             ","01.02.2020 14_01_311","2020-02-01 14:01:31","2020-02-01"," 14:01:31"
"Blind_26.01.2020","0","26/01/2020",100,NA,10,20,"","Blind 26.01.2020","blind",16916,"15:0","PUFA-KF_01.02.2020 14_01_311","Blind 26.01.2020","             ","01.02.2020 14_01_311","2020-02-01 14:01:31","2020-02-01"," 14:01:31"
"Blind_26.01.2020","0","26/01/2020",100,NA,10,20,"","Blind 26.01.2020","blind",1633,"16:1n-7","PUFA-KF_01.02.2020 14_01_311","Blind 26.01.2020","             ","01.02.2020 14_01_311","2020-02-01 14:01:31","2020-02-01"," 14:01:31"
"Blind_26.01.2020","0","26/01/2020",100,NA,10,20,"","Blind 26.01.2020","blind",2668,"17:0","PUFA-KF_01.02.2020 14_01_311","Blind 26.01.2020","             ","01.02.2020 14_01_311","2020-02-01 14:01:31","2020-02-01"," 14:01:31"
"Blind_26.01.2020","0","26/01/2020",100,NA,10,20,"","Blind 26.01.2020","blind",15489,"18:0","PUFA-KF_01.02.2020 14_01_311","Blind 26.01.2020","             ","01.02.2020 14_01_311","2020-02-01 14:01:31","2020-02-01"," 14:01:31"
"Blind_26.01.2020","0","26/01/2020",100,NA,10,20,"","Blind 26.01.2020","blind",3053,"18:1n-9t","PUFA-KF_01.02.2020 14_01_311","Blind 26.01.2020","             ","01.02.2020 14_01_311","2020-02-01 14:01:31","2020-02-01"," 14:01:31"
"Blind_26.01.2020","0","26/01/2020",100,NA,10,20,"","Blind 26.01.2020","blind",395,"18:1n-9c","PUFA-KF_01.02.2020 14_01_311","Blind 26.01.2020","             ","01.02.2020 14_01_311","2020-02-01 14:01:31","2020-02-01"," 14:01:31"
"Blind_26.01.2020","0","26/01/2020",100,NA,10,20,"","Blind 26.01.2020","blind",107364,"18:2n-6t","PUFA-KF_01.02.2020 14_01_311","Blind 26.01.2020","             ","01.02.2020 14_01_311","2020-02-01 14:01:31","2020-02-01"," 14:01:31"
"Blind_26.01.2020","0","26/01/2020",100,NA,10,20,"","Blind 26.01.2020","blind",183963,"18:2n-6c","PUFA-KF_01.02.2020 14_01_311","Blind 26.01.2020","             ","01.02.2020 14_01_311","2020-02-01 14:01:31","2020-02-01"," 14:01:31"
"Blind_26.01.2020","0","26/01/2020",100,NA,10,20,"","Blind 26.01.2020","blind",7053,"18:3n-3","PUFA-KF_01.02.2020 14_01_311","Blind 26.01.2020","             ","01.02.2020 14_01_311","2020-02-01 14:01:31","2020-02-01"," 14:01:31"
"Blind_26.01.2020","0","26/01/2020",100,NA,10,20,"","Blind 26.01.2020","blind",150,"20:0","PUFA-KF_01.02.2020 14_01_311","Blind 26.01.2020","             ","01.02.2020 14_01_311","2020-02-01 14:01:31","2020-02-01"," 14:01:31"
"Blind_26.01.2020","0","26/01/2020",100,NA,10,20,"","Blind 26.01.2020","blind",8670,"20:2n-6","PUFA-KF_01.02.2020 14_01_311","Blind 26.01.2020","             ","01.02.2020 14_01_311","2020-02-01 14:01:31","2020-02-01"," 14:01:31"
"Blind_26.01.2020","0","26/01/2020",100,NA,10,20,"","Blind 26.01.2020","blind",210,"20:3n-6","PUFA-KF_01.02.2020 14_01_311","Blind 26.01.2020","             ","01.02.2020 14_01_311","2020-02-01 14:01:31","2020-02-01"," 14:01:31"
"Blind_26.01.2020","0","26/01/2020",100,NA,10,20,"","Blind 26.01.2020","blind",26149,"20:4n-6","PUFA-KF_01.02.2020 14_01_311","Blind 26.01.2020","             ","01.02.2020 14_01_311","2020-02-01 14:01:31","2020-02-01"," 14:01:31"
"Blind_26.01.2020","0","26/01/2020",100,NA,10,20,"","Blind 26.01.2020","blind",442,"21:0","PUFA-KF_01.02.2020 14_01_311","Blind 26.01.2020","             ","01.02.2020 14_01_311","2020-02-01 14:01:31","2020-02-01"," 14:01:31"
"Blind_26.01.2020","0","26/01/2020",100,NA,10,20,"","Blind 26.01.2020","blind",1234,"20:3n-3","PUFA-KF_01.02.2020 14_01_311","Blind 26.01.2020","             ","01.02.2020 14_01_311","2020-02-01 14:01:31","2020-02-01"," 14:01:31"
"Blind_26.01.2020","0","26/01/2020",100,NA,10,20,"","Blind 26.01.2020","blind",56514,"20:5n-3","PUFA-KF_01.02.2020 14_01_311","Blind 26.01.2020","             ","01.02.2020 14_01_311","2020-02-01 14:01:31","2020-02-01"," 14:01:31"
"Blind_26.01.2020","0","26/01/2020",100,NA,10,20,"","Blind 26.01.2020","blind",29435,"22:0","PUFA-KF_01.02.2020 14_01_311","Blind 26.01.2020","             ","01.02.2020 14_01_311","2020-02-01 14:01:31","2020-02-01"," 14:01:31"
"Blind_26.01.2020","0","26/01/2020",100,NA,10,20,"","Blind 26.01.2020","blind",831,"22:1n-9","PUFA-KF_01.02.2020 14_01_311","Blind 26.01.2020","             ","01.02.2020 14_01_311","2020-02-01 14:01:31","2020-02-01"," 14:01:31"
"Blind_26.01.2020","0","26/01/2020",100,NA,10,20,"","Blind 26.01.2020","blind",473,"22:2n-6","PUFA-KF_01.02.2020 14_01_311","Blind 26.01.2020","             ","01.02.2020 14_01_311","2020-02-01 14:01:31","2020-02-01"," 14:01:31"
"Blind_26.01.2020","0","26/01/2020",100,NA,10,20,"","Blind 26.01.2020","blind",31287,"23:0","PUFA-KF_01.02.2020 14_01_311","Blind 26.01.2020","             ","01.02.2020 14_01_311","2020-02-01 14:01:31","2020-02-01"," 14:01:31"
"Blind_26.01.2020","0","26/01/2020",100,NA,10,20,"","Blind 26.01.2020","blind",59152,"22:6n-3","PUFA-KF_01.02.2020 14_01_311","Blind 26.01.2020","             ","01.02.2020 14_01_311","2020-02-01 14:01:31","2020-02-01"," 14:01:31"
"Blind_26.01.2020","0","26/01/2020",100,NA,10,20,"","Blind 26.01.2020","blind",34794,"24:0","PUFA-KF_01.02.2020 14_01_311","Blind 26.01.2020","             ","01.02.2020 14_01_311","2020-02-01 14:01:31","2020-02-01"," 14:01:31"
"Blind_26.01.2020","0","26/01/2020",100,NA,10,20,"","Blind 26.01.2020","blind",23693,"24:1n-9","PUFA-KF_01.02.2020 14_01_311","Blind 26.01.2020","             ","01.02.2020 14_01_311","2020-02-01 14:01:31","2020-02-01"," 14:01:31"
"Blind_1_06.02.2020","0","06/02/2020",100,NA,10,20,"","Blind 1 06.02.2020","blind",70577,"14:0","PUFA-KF_13.02.2020 05_39_0624","Blind 1 06.02.2020","             ","13.02.2020 05_39_0624","2020-02-13 05:39:06","2020-02-13"," 05:39:06"
"Blind_1_06.02.2020","0","06/02/2020",100,NA,10,20,"","Blind 1 06.02.2020","blind",1977,"22:0","PUFA-KF_13.02.2020 05_39_0624","Blind 1 06.02.2020","             ","13.02.2020 05_39_0624","2020-02-13 05:39:06","2020-02-13"," 05:39:06"
"Blind_1_06.02.2020","0","06/02/2020",100,NA,10,20,"","Blind 1 06.02.2020","blind",363,"22:2n-6","PUFA-KF_13.02.2020 05_39_0624","Blind 1 06.02.2020","             ","13.02.2020 05_39_0624","2020-02-13 05:39:06","2020-02-13"," 05:39:06"
"Blind_1_06.02.2020","0","06/02/2020",100,NA,10,20,"","Blind 1 06.02.2020","blind",873,"23:0","PUFA-KF_13.02.2020 05_39_0624","Blind 1 06.02.2020","             ","13.02.2020 05_39_0624","2020-02-13 05:39:06","2020-02-13"," 05:39:06"
"Blind_1_06.02.2020","0","06/02/2020",100,NA,10,20,"","Blind 1 06.02.2020","blind",8593,"22:6n-3","PUFA-KF_13.02.2020 05_39_0624","Blind 1 06.02.2020","             ","13.02.2020 05_39_0624","2020-02-13 05:39:06","2020-02-13"," 05:39:06"
"Blind_1_06.02.2020","0","06/02/2020",100,NA,10,20,"","Blind 1 06.02.2020","blind",149,"24:0","PUFA-KF_13.02.2020 05_39_0624","Blind 1 06.02.2020","             ","13.02.2020 05_39_0624","2020-02-13 05:39:06","2020-02-13"," 05:39:06"
"Blind_1_06.02.2020","0","06/02/2020",100,NA,10,20,"","Blind 1 06.02.2020","blind",92,"24:1n-9","PUFA-KF_13.02.2020 05_39_0624","Blind 1 06.02.2020","             ","13.02.2020 05_39_0624","2020-02-13 05:39:06","2020-02-13"," 05:39:06"
"Blind_1_03.02.2020","0","03/02/2020",50,NA,10,20,"check, in wie viel MeOH gelst","Blind 1 03.02.2020","blind",43678,"12:0","PUFA-KF_13.02.2020 15_53_3935","Blind 1 03.02.2020","             ","13.02.2020 15_53_3935","2020-02-13 15:53:39","2020-02-13"," 15:53:39"
"Blind_1_03.02.2020","0","03/02/2020",50,NA,10,20,"check, in wie viel MeOH gelst","Blind 1 03.02.2020","blind",118908,"14:0","PUFA-KF_13.02.2020 15_53_3935","Blind 1 03.02.2020","             ","13.02.2020 15_53_3935","2020-02-13 15:53:39","2020-02-13"," 15:53:39"
"Blind_1_03.02.2020","0","03/02/2020",50,NA,10,20,"check, in wie viel MeOH gelst","Blind 1 03.02.2020","blind",63335,"18:1n-7","PUFA-KF_13.02.2020 15_53_3935","Blind 1 03.02.2020","             ","13.02.2020 15_53_3935","2020-02-13 15:53:39","2020-02-13"," 15:53:39"
"Blind_1_03.02.2020","0","03/02/2020",50,NA,10,20,"check, in wie viel MeOH gelst","Blind 1 03.02.2020","blind",26136,"18:2n-6t","PUFA-KF_13.02.2020 15_53_3935","Blind 1 03.02.2020","             ","13.02.2020 15_53_3935","2020-02-13 15:53:39","2020-02-13"," 15:53:39"
"Blind_1_03.02.2020","0","03/02/2020",50,NA,10,20,"check, in wie viel MeOH gelst","Blind 1 03.02.2020","blind",141030,"18:2n-6c","PUFA-KF_13.02.2020 15_53_3935","Blind 1 03.02.2020","             ","13.02.2020 15_53_3935","2020-02-13 15:53:39","2020-02-13"," 15:53:39"
"Blind_1_03.02.2020","0","03/02/2020",50,NA,10,20,"check, in wie viel MeOH gelst","Blind 1 03.02.2020","blind",36678,"22:0","PUFA-KF_13.02.2020 15_53_3935","Blind 1 03.02.2020","             ","13.02.2020 15_53_3935","2020-02-13 15:53:39","2020-02-13"," 15:53:39"
"Blind_1_03.02.2020","0","03/02/2020",50,NA,10,20,"check, in wie viel MeOH gelst","Blind 1 03.02.2020","blind",505,"22:1n-9","PUFA-KF_13.02.2020 15_53_3935","Blind 1 03.02.2020","             ","13.02.2020 15_53_3935","2020-02-13 15:53:39","2020-02-13"," 15:53:39"
"Blind_1_03.02.2020","0","03/02/2020",50,NA,10,20,"check, in wie viel MeOH gelst","Blind 1 03.02.2020","blind",925,"23:0","PUFA-KF_13.02.2020 15_53_3935","Blind 1 03.02.2020","             ","13.02.2020 15_53_3935","2020-02-13 15:53:39","2020-02-13"," 15:53:39"
"Blind_1_03.02.2020","0","03/02/2020",50,NA,10,20,"check, in wie viel MeOH gelst","Blind 1 03.02.2020","blind",33317,"22:6n-3","PUFA-KF_13.02.2020 15_53_3935","Blind 1 03.02.2020","             ","13.02.2020 15_53_3935","2020-02-13 15:53:39","2020-02-13"," 15:53:39"
"Blind_1_02.02.2020","0","02/02/2020",50,NA,10,20,"check, in wie viel MeOH gelst","Blind 1 02.02.2020","blind",13787,"12:0","PUFA-KF_13.02.2020 16_49_2436","Blind 1 02.02.2020","             ","13.02.2020 16_49_2436","2020-02-13 16:49:24","2020-02-13"," 16:49:24"
"Blind_1_02.02.2020","0","02/02/2020",50,NA,10,20,"check, in wie viel MeOH gelst","Blind 1 02.02.2020","blind",100408,"14:0","PUFA-KF_13.02.2020 16_49_2436","Blind 1 02.02.2020","             ","13.02.2020 16_49_2436","2020-02-13 16:49:24","2020-02-13"," 16:49:24"
"Blind_1_02.02.2020","0","02/02/2020",50,NA,10,20,"check, in wie viel MeOH gelst","Blind 1 02.02.2020","blind",8447,"18:1n-7","PUFA-KF_13.02.2020 16_49_2436","Blind 1 02.02.2020","             ","13.02.2020 16_49_2436","2020-02-13 16:49:24","2020-02-13"," 16:49:24"
"Blind_1_02.02.2020","0","02/02/2020",50,NA,10,20,"check, in wie viel MeOH gelst","Blind 1 02.02.2020","blind",7771,"18:2n-6t","PUFA-KF_13.02.2020 16_49_2436","Blind 1 02.02.2020","             ","13.02.2020 16_49_2436","2020-02-13 16:49:24","2020-02-13"," 16:49:24"
"Blind_1_02.02.2020","0","02/02/2020",50,NA,10,20,"check, in wie viel MeOH gelst","Blind 1 02.02.2020","blind",14488,"18:2n-6c","PUFA-KF_13.02.2020 16_49_2436","Blind 1 02.02.2020","             ","13.02.2020 16_49_2436","2020-02-13 16:49:24","2020-02-13"," 16:49:24"
"Blind_1_20.01.2020","0","20/02/2020",100,NA,10,20,"","Blind 1 20.01.2020","blind",45575,"12:0","PUFA-KF_22.01.2020 09_09_5124","Blank 1 20.01.2020","             ","22.01.2020 09_09_5124","2020-01-22 09:09:51","2020-01-22"," 09:09:51"
"Blind_1_20.01.2020","0","20/02/2020",100,NA,10,20,"","Blind 1 20.01.2020","blind",204266,"14:0","PUFA-KF_22.01.2020 09_09_5124","Blank 1 20.01.2020","             ","22.01.2020 09_09_5124","2020-01-22 09:09:51","2020-01-22"," 09:09:51"
"Blind_1_20.01.2020","0","20/02/2020",100,NA,10,20,"","Blind 1 20.01.2020","blind",56745,"15:1n-5","PUFA-KF_22.01.2020 09_09_5124","Blank 1 20.01.2020","             ","22.01.2020 09_09_5124","2020-01-22 09:09:51","2020-01-22"," 09:09:51"
"Blind_1_20.01.2020","0","20/02/2020",100,NA,10,20,"","Blind 1 20.01.2020","blind",33897,"16:0","PUFA-KF_22.01.2020 09_09_5124","Blank 1 20.01.2020","             ","22.01.2020 09_09_5124","2020-01-22 09:09:51","2020-01-22"," 09:09:51"
"Blind_1_20.01.2020","0","20/02/2020",100,NA,10,20,"","Blind 1 20.01.2020","blind",6252,"16:1n-7","PUFA-KF_22.01.2020 09_09_5124","Blank 1 20.01.2020","             ","22.01.2020 09_09_5124","2020-01-22 09:09:51","2020-01-22"," 09:09:51"
"Blind_1_20.01.2020","0","20/02/2020",100,NA,10,20,"","Blind 1 20.01.2020","blind",127163,"18:0","PUFA-KF_22.01.2020 09_09_5124","Blank 1 20.01.2020","             ","22.01.2020 09_09_5124","2020-01-22 09:09:51","2020-01-22"," 09:09:51"
"Blind_1_20.01.2020","0","20/02/2020",100,NA,10,20,"","Blind 1 20.01.2020","blind",114091,"18:1n-9t","PUFA-KF_22.01.2020 09_09_5124","Blank 1 20.01.2020","             ","22.01.2020 09_09_5124","2020-01-22 09:09:51","2020-01-22"," 09:09:51"
"Blind_1_20.01.2020","0","20/02/2020",100,NA,10,20,"","Blind 1 20.01.2020","blind",481,"18:1n-9c","PUFA-KF_22.01.2020 09_09_5124","Blank 1 20.01.2020","             ","22.01.2020 09_09_5124","2020-01-22 09:09:51","2020-01-22"," 09:09:51"
"Blind_1_20.01.2020","0","20/02/2020",100,NA,10,20,"","Blind 1 20.01.2020","blind",352139,"18:1n-7","PUFA-KF_22.01.2020 09_09_5124","Blank 1 20.01.2020","             ","22.01.2020 09_09_5124","2020-01-22 09:09:51","2020-01-22"," 09:09:51"
"Blind_1_20.01.2020","0","20/02/2020",100,NA,10,20,"","Blind 1 20.01.2020","blind",625530,"18:2n-6t","PUFA-KF_22.01.2020 09_09_5124","Blank 1 20.01.2020","             ","22.01.2020 09_09_5124","2020-01-22 09:09:51","2020-01-22"," 09:09:51"
"Blind_1_20.01.2020","0","20/02/2020",100,NA,10,20,"","Blind 1 20.01.2020","blind",638451,"18:2n-6c","PUFA-KF_22.01.2020 09_09_5124","Blank 1 20.01.2020","             ","22.01.2020 09_09_5124","2020-01-22 09:09:51","2020-01-22"," 09:09:51"
"Blind_1_20.01.2020","0","20/02/2020",100,NA,10,20,"","Blind 1 20.01.2020","blind",732,"18:3n-6","PUFA-KF_22.01.2020 09_09_5124","Blank 1 20.01.2020","             ","22.01.2020 09_09_5124","2020-01-22 09:09:51","2020-01-22"," 09:09:51"
"Blind_1_20.01.2020","0","20/02/2020",100,NA,10,20,"","Blind 1 20.01.2020","blind",1759,"18:3n-3","PUFA-KF_22.01.2020 09_09_5124","Blank 1 20.01.2020","             ","22.01.2020 09_09_5124","2020-01-22 09:09:51","2020-01-22"," 09:09:51"
"Blind_1_20.01.2020","0","20/02/2020",100,NA,10,20,"","Blind 1 20.01.2020","blind",10718,"20:0","PUFA-KF_22.01.2020 09_09_5124","Blank 1 20.01.2020","             ","22.01.2020 09_09_5124","2020-01-22 09:09:51","2020-01-22"," 09:09:51"
"Blind_1_20.01.2020","0","20/02/2020",100,NA,10,20,"","Blind 1 20.01.2020","blind",13646,"20:1n-9","PUFA-KF_22.01.2020 09_09_5124","Blank 1 20.01.2020","             ","22.01.2020 09_09_5124","2020-01-22 09:09:51","2020-01-22"," 09:09:51"
"Blind_1_20.01.2020","0","20/02/2020",100,NA,10,20,"","Blind 1 20.01.2020","blind",12966,"20:2n-6","PUFA-KF_22.01.2020 09_09_5124","Blank 1 20.01.2020","             ","22.01.2020 09_09_5124","2020-01-22 09:09:51","2020-01-22"," 09:09:51"
"Blind_1_20.01.2020","0","20/02/2020",100,NA,10,20,"","Blind 1 20.01.2020","blind",2072,"20:3n-6","PUFA-KF_22.01.2020 09_09_5124","Blank 1 20.01.2020","             ","22.01.2020 09_09_5124","2020-01-22 09:09:51","2020-01-22"," 09:09:51"
"Blind_1_20.01.2020","0","20/02/2020",100,NA,10,20,"","Blind 1 20.01.2020","blind",57486,"20:4n-6","PUFA-KF_22.01.2020 09_09_5124","Blank 1 20.01.2020","             ","22.01.2020 09_09_5124","2020-01-22 09:09:51","2020-01-22"," 09:09:51"
"Blind_1_20.01.2020","0","20/02/2020",100,NA,10,20,"","Blind 1 20.01.2020","blind",601,"21:0","PUFA-KF_22.01.2020 09_09_5124","Blank 1 20.01.2020","             ","22.01.2020 09_09_5124","2020-01-22 09:09:51","2020-01-22"," 09:09:51"
"Blind_1_20.01.2020","0","20/02/2020",100,NA,10,20,"","Blind 1 20.01.2020","blind",1640,"20:3n-3","PUFA-KF_22.01.2020 09_09_5124","Blank 1 20.01.2020","             ","22.01.2020 09_09_5124","2020-01-22 09:09:51","2020-01-22"," 09:09:51"
"Blind_1_20.01.2020","0","20/02/2020",100,NA,10,20,"","Blind 1 20.01.2020","blind",1734,"20:5n-3","PUFA-KF_22.01.2020 09_09_5124","Blank 1 20.01.2020","             ","22.01.2020 09_09_5124","2020-01-22 09:09:51","2020-01-22"," 09:09:51"
"Blind_1_20.01.2020","0","20/02/2020",100,NA,10,20,"","Blind 1 20.01.2020","blind",36251,"22:0","PUFA-KF_22.01.2020 09_09_5124","Blank 1 20.01.2020","             ","22.01.2020 09_09_5124","2020-01-22 09:09:51","2020-01-22"," 09:09:51"
"Blind_1_20.01.2020","0","20/02/2020",100,NA,10,20,"","Blind 1 20.01.2020","blind",411,"22:1n-9","PUFA-KF_22.01.2020 09_09_5124","Blank 1 20.01.2020","             ","22.01.2020 09_09_5124","2020-01-22 09:09:51","2020-01-22"," 09:09:51"
"Blind_1_20.01.2020","0","20/02/2020",100,NA,10,20,"","Blind 1 20.01.2020","blind",703,"22:2n-6","PUFA-KF_22.01.2020 09_09_5124","Blank 1 20.01.2020","             ","22.01.2020 09_09_5124","2020-01-22 09:09:51","2020-01-22"," 09:09:51"
"Blind_1_20.01.2020","0","20/02/2020",100,NA,10,20,"","Blind 1 20.01.2020","blind",39826,"22:6n-3","PUFA-KF_22.01.2020 09_09_5124","Blank 1 20.01.2020","             ","22.01.2020 09_09_5124","2020-01-22 09:09:51","2020-01-22"," 09:09:51"
"Blind_2_20.01.2020","0","20/02/2020",100,NA,10,20,"check, in wie viel MeOH gelst","Blind 2 20.01.2020","blind",31714,"12:0","PUFA-KF_26.01.2020 05_02_0223","Blind 2 20.01.2020","             ","26.01.2020 05_02_0223","2020-01-26 05:02:02","2020-01-26"," 05:02:02"
"Blind_2_20.01.2020","0","20/02/2020",100,NA,10,20,"check, in wie viel MeOH gelst","Blind 2 20.01.2020","blind",106870,"13:0","PUFA-KF_26.01.2020 05_02_0223","Blind 2 20.01.2020","             ","26.01.2020 05_02_0223","2020-01-26 05:02:02","2020-01-26"," 05:02:02"
"Blind_2_20.01.2020","0","20/02/2020",100,NA,10,20,"check, in wie viel MeOH gelst","Blind 2 20.01.2020","blind",12921,"15:1n-5","PUFA-KF_26.01.2020 05_02_0223","Blind 2 20.01.2020","             ","26.01.2020 05_02_0223","2020-01-26 05:02:02","2020-01-26"," 05:02:02"
"Blind_2_20.01.2020","0","20/02/2020",100,NA,10,20,"check, in wie viel MeOH gelst","Blind 2 20.01.2020","blind",304205,"17:1n-7","PUFA-KF_26.01.2020 05_02_0223","Blind 2 20.01.2020","             ","26.01.2020 05_02_0223","2020-01-26 05:02:02","2020-01-26"," 05:02:02"
"Blind_2_20.01.2020","0","20/02/2020",100,NA,10,20,"check, in wie viel MeOH gelst","Blind 2 20.01.2020","blind",53273,"18:0","PUFA-KF_26.01.2020 05_02_0223","Blind 2 20.01.2020","             ","26.01.2020 05_02_0223","2020-01-26 05:02:02","2020-01-26"," 05:02:02"
"Blind_2_20.01.2020","0","20/02/2020",100,NA,10,20,"check, in wie viel MeOH gelst","Blind 2 20.01.2020","blind",383791,"18:1n-9t","PUFA-KF_26.01.2020 05_02_0223","Blind 2 20.01.2020","             ","26.01.2020 05_02_0223","2020-01-26 05:02:02","2020-01-26"," 05:02:02"
"Blind_2_20.01.2020","0","20/02/2020",100,NA,10,20,"check, in wie viel MeOH gelst","Blind 2 20.01.2020","blind",33736,"18:1n-9c","PUFA-KF_26.01.2020 05_02_0223","Blind 2 20.01.2020","             ","26.01.2020 05_02_0223","2020-01-26 05:02:02","2020-01-26"," 05:02:02"
"Blind_2_20.01.2020","0","20/02/2020",100,NA,10,20,"check, in wie viel MeOH gelst","Blind 2 20.01.2020","blind",8381504,"18:2n-6t","PUFA-KF_26.01.2020 05_02_0223","Blind 2 20.01.2020","             ","26.01.2020 05_02_0223","2020-01-26 05:02:02","2020-01-26"," 05:02:02"
"Blind_2_20.01.2020","0","20/02/2020",100,NA,10,20,"check, in wie viel MeOH gelst","Blind 2 20.01.2020","blind",64978,"18:3n-6","PUFA-KF_26.01.2020 05_02_0223","Blind 2 20.01.2020","             ","26.01.2020 05_02_0223","2020-01-26 05:02:02","2020-01-26"," 05:02:02"
"Blind_2_20.01.2020","0","20/02/2020",100,NA,10,20,"check, in wie viel MeOH gelst","Blind 2 20.01.2020","blind",49588,"20:0","PUFA-KF_26.01.2020 05_02_0223","Blind 2 20.01.2020","             ","26.01.2020 05_02_0223","2020-01-26 05:02:02","2020-01-26"," 05:02:02"
"Blind_2_20.01.2020","0","20/02/2020",100,NA,10,20,"check, in wie viel MeOH gelst","Blind 2 20.01.2020","blind",7060,"20:2n-6","PUFA-KF_26.01.2020 05_02_0223","Blind 2 20.01.2020","             ","26.01.2020 05_02_0223","2020-01-26 05:02:02","2020-01-26"," 05:02:02"
"Blind_2_20.01.2020","0","20/02/2020",100,NA,10,20,"check, in wie viel MeOH gelst","Blind 2 20.01.2020","blind",4170,"20:3n-6","PUFA-KF_26.01.2020 05_02_0223","Blind 2 20.01.2020","             ","26.01.2020 05_02_0223","2020-01-26 05:02:02","2020-01-26"," 05:02:02"
"Blind_2_20.01.2020","0","20/02/2020",100,NA,10,20,"check, in wie viel MeOH gelst","Blind 2 20.01.2020","blind",14418,"20:3n-3","PUFA-KF_26.01.2020 05_02_0223","Blind 2 20.01.2020","             ","26.01.2020 05_02_0223","2020-01-26 05:02:02","2020-01-26"," 05:02:02"
"Blind_2_20.01.2020","0","20/02/2020",100,NA,10,20,"check, in wie viel MeOH gelst","Blind 2 20.01.2020","blind",81718,"20:5n-3","PUFA-KF_26.01.2020 05_02_0223","Blind 2 20.01.2020","             ","26.01.2020 05_02_0223","2020-01-26 05:02:02","2020-01-26"," 05:02:02"
"Blind_2_20.01.2020","0","20/02/2020",100,NA,10,20,"check, in wie viel MeOH gelst","Blind 2 20.01.2020","blind",62359,"23:0","PUFA-KF_26.01.2020 05_02_0223","Blind 2 20.01.2020","             ","26.01.2020 05_02_0223","2020-01-26 05:02:02","2020-01-26"," 05:02:02"
"Blind_2_21.01.2020","0","21/02/2020",100,NA,10,20,"check, in wie viel MeOH gelst","Blind 2 21.01.2020","blind",48483,"13:0","PUFA-KF_26.01.2020 15_14_0534","Blind 2 21.01.2020","             ","26.01.2020 15_14_0534","2020-01-26 15:14:05","2020-01-26"," 15:14:05"
"Blind_2_21.01.2020","0","21/02/2020",100,NA,10,20,"check, in wie viel MeOH gelst","Blind 2 21.01.2020","blind",24889,"16:0","PUFA-KF_26.01.2020 15_14_0534","Blind 2 21.01.2020","             ","26.01.2020 15_14_0534","2020-01-26 15:14:05","2020-01-26"," 15:14:05"
"Blind_2_21.01.2020","0","21/02/2020",100,NA,10,20,"check, in wie viel MeOH gelst","Blind 2 21.01.2020","blind",8169,"17:1n-7","PUFA-KF_26.01.2020 15_14_0534","Blind 2 21.01.2020","             ","26.01.2020 15_14_0534","2020-01-26 15:14:05","2020-01-26"," 15:14:05"
"Blind_2_21.01.2020","0","21/02/2020",100,NA,10,20,"check, in wie viel MeOH gelst","Blind 2 21.01.2020","blind",18519,"18:0","PUFA-KF_26.01.2020 15_14_0534","Blind 2 21.01.2020","             ","26.01.2020 15_14_0534","2020-01-26 15:14:05","2020-01-26"," 15:14:05"
"Blind_2_21.01.2020","0","21/02/2020",100,NA,10,20,"check, in wie viel MeOH gelst","Blind 2 21.01.2020","blind",257218,"18:1n-9t","PUFA-KF_26.01.2020 15_14_0534","Blind 2 21.01.2020","             ","26.01.2020 15_14_0534","2020-01-26 15:14:05","2020-01-26"," 15:14:05"
"Blind_2_21.01.2020","0","21/02/2020",100,NA,10,20,"check, in wie viel MeOH gelst","Blind 2 21.01.2020","blind",2745,"18:1n-9c","PUFA-KF_26.01.2020 15_14_0534","Blind 2 21.01.2020","             ","26.01.2020 15_14_0534","2020-01-26 15:14:05","2020-01-26"," 15:14:05"
"Blind_2_21.01.2020","0","21/02/2020",100,NA,10,20,"check, in wie viel MeOH gelst","Blind 2 21.01.2020","blind",1533485,"18:2n-6t","PUFA-KF_26.01.2020 15_14_0534","Blind 2 21.01.2020","             ","26.01.2020 15_14_0534","2020-01-26 15:14:05","2020-01-26"," 15:14:05"
"Blind_2_21.01.2020","0","21/02/2020",100,NA,10,20,"check, in wie viel MeOH gelst","Blind 2 21.01.2020","blind",24058,"18:2n-6c","PUFA-KF_26.01.2020 15_14_0534","Blind 2 21.01.2020","             ","26.01.2020 15_14_0534","2020-01-26 15:14:05","2020-01-26"," 15:14:05"
"Blind_2_21.01.2020","0","21/02/2020",100,NA,10,20,"check, in wie viel MeOH gelst","Blind 2 21.01.2020","blind",505627,"18:3n-6","PUFA-KF_26.01.2020 15_14_0534","Blind 2 21.01.2020","             ","26.01.2020 15_14_0534","2020-01-26 15:14:05","2020-01-26"," 15:14:05"
"Blind_2_21.01.2020","0","21/02/2020",100,NA,10,20,"check, in wie viel MeOH gelst","Blind 2 21.01.2020","blind",81396,"18:3n-3","PUFA-KF_26.01.2020 15_14_0534","Blind 2 21.01.2020","             ","26.01.2020 15_14_0534","2020-01-26 15:14:05","2020-01-26"," 15:14:05"
"Blind_2_21.01.2020","0","21/02/2020",100,NA,10,20,"check, in wie viel MeOH gelst","Blind 2 21.01.2020","blind",3159,"20:0","PUFA-KF_26.01.2020 15_14_0534","Blind 2 21.01.2020","             ","26.01.2020 15_14_0534","2020-01-26 15:14:05","2020-01-26"," 15:14:05"
"Blind_2_21.01.2020","0","21/02/2020",100,NA,10,20,"check, in wie viel MeOH gelst","Blind 2 21.01.2020","blind",192,"20:2n-6","PUFA-KF_26.01.2020 15_14_0534","Blind 2 21.01.2020","             ","26.01.2020 15_14_0534","2020-01-26 15:14:05","2020-01-26"," 15:14:05"
"Blind_2_21.01.2020","0","21/02/2020",100,NA,10,20,"check, in wie viel MeOH gelst","Blind 2 21.01.2020","blind",192,"20:3n-6","PUFA-KF_26.01.2020 15_14_0534","Blind 2 21.01.2020","             ","26.01.2020 15_14_0534","2020-01-26 15:14:05","2020-01-26"," 15:14:05"
"Blind_2_21.01.2020","0","21/02/2020",100,NA,10,20,"check, in wie viel MeOH gelst","Blind 2 21.01.2020","blind",642,"20:4n-6","PUFA-KF_26.01.2020 15_14_0534","Blind 2 21.01.2020","             ","26.01.2020 15_14_0534","2020-01-26 15:14:05","2020-01-26"," 15:14:05"
"Blind_2_21.01.2020","0","21/02/2020",100,NA,10,20,"check, in wie viel MeOH gelst","Blind 2 21.01.2020","blind",753366,"21:0","PUFA-KF_26.01.2020 15_14_0534","Blind 2 21.01.2020","             ","26.01.2020 15_14_0534","2020-01-26 15:14:05","2020-01-26"," 15:14:05"
"Blind_2_21.01.2020","0","21/02/2020",100,NA,10,20,"check, in wie viel MeOH gelst","Blind 2 21.01.2020","blind",13437,"20:3n-3","PUFA-KF_26.01.2020 15_14_0534","Blind 2 21.01.2020","             ","26.01.2020 15_14_0534","2020-01-26 15:14:05","2020-01-26"," 15:14:05"
"Blind_2_21.01.2020","0","21/02/2020",100,NA,10,20,"check, in wie viel MeOH gelst","Blind 2 21.01.2020","blind",66465,"20:5n-3","PUFA-KF_26.01.2020 15_14_0534","Blind 2 21.01.2020","             ","26.01.2020 15_14_0534","2020-01-26 15:14:05","2020-01-26"," 15:14:05"
"Blind_2_21.01.2020","0","21/02/2020",100,NA,10,20,"check, in wie viel MeOH gelst","Blind 2 21.01.2020","blind",277,"22:2n-6","PUFA-KF_26.01.2020 15_14_0534","Blind 2 21.01.2020","             ","26.01.2020 15_14_0534","2020-01-26 15:14:05","2020-01-26"," 15:14:05"
"Blind_2_21.01.2020","0","21/02/2020",100,NA,10,20,"check, in wie viel MeOH gelst","Blind 2 21.01.2020","blind",634,"23:0","PUFA-KF_26.01.2020 15_14_0534","Blind 2 21.01.2020","             ","26.01.2020 15_14_0534","2020-01-26 15:14:05","2020-01-26"," 15:14:05"
"Blind_2_21.01.2020","0","21/02/2020",100,NA,10,20,"check, in wie viel MeOH gelst","Blind 2 21.01.2020","blind",8578,"22:6n-3","PUFA-KF_26.01.2020 15_14_0534","Blind 2 21.01.2020","             ","26.01.2020 15_14_0534","2020-01-26 15:14:05","2020-01-26"," 15:14:05"
"Blind_2_21.01.2020","0","21/02/2020",100,NA,10,20,"check, in wie viel MeOH gelst","Blind 2 21.01.2020","blind",307,"24:0","PUFA-KF_26.01.2020 15_14_0534","Blind 2 21.01.2020","             ","26.01.2020 15_14_0534","2020-01-26 15:14:05","2020-01-26"," 15:14:05"
